Name,Type,Default,Choices,Description,Config
download-dir,str,None,,"Directory to download and load the weights, default to<br>the default cache directory of Hugging Face.",LoadConfig
ignore-patterns,List,['original/**/*'],,"The list of patterns to ignore when loading the model.<br>Default to ""original/**/*"" to avoid repeated loading<br>of llama's checkpoints.",LoadConfig
load-format,str,auto,,"The format of the model weights to load.<br>- ""auto"" will try to load the weights in the<br>safetensors format and fall back to the pytorch bin<br>format if safetensors format is not available.<br>- ""pt"" will load the weights in the pytorch bin<br>format.<br>- ""safetensors"" will load the weights in the<br>safetensors format.<br>- ""instanttensor"" will load the Safetensors weights on<br>CUDA devices using InstantTensor, which enables<br>distributed loading with pipelined prefetching and<br>fast direct I/O.<br>- ""npcache"" will load the weights in pytorch format<br>and store a numpy cache to speed up the loading.<br>- ""dummy"" will initialize the weights with random<br>values, which is mainly for profiling.<br>- ""tensorizer"" will use CoreWeave's tensorizer library<br>for fast weight loading. See the Tensorize vLLM Model<br>script in the Examples section for more information.<br>- ""runai_streamer"" will load the Safetensors weights<br>using Run:ai Model Streamer.<br>- ""runai_streamer_sharded"" will load weights from pre-<br>sharded checkpoint files using Run:ai Model Streamer.<br>- ""bitsandbytes"" will load the weights using<br>bitsandbytes quantization.<br>- ""sharded_state"" will load weights from pre-sharded<br>checkpoint files, supporting efficient loading of<br>tensor-parallel models.<br>- ""gguf"" will load weights from GGUF format files<br>(details specified in https://github.com/ggml-<br>org/ggml/blob/master/docs/gguf.md).<br>- ""mistral"" will load weights from consolidated<br>safetensors files used by Mistral models.<br>- ""modelexpress"" will load weights using ModelExpress.<br>- Other custom values can be supported via plugins.",LoadConfig
model-loader-extra-config,dict,{},,Extra config for model loader. This will be passed to<br>the model loader corresponding to the chosen<br>load_format.,LoadConfig
pt-load-map-location,str,cpu,,"The map location for loading pytorch checkpoint, to<br>support loading checkpoints can only be loaded on<br>certain devices like ""cuda"", this is equivalent to<br>`{"""": ""cuda""}`. Another supported format is mapping<br>from different devices like from GPU 1 to GPU 0:<br>`{""cuda:1"": ""cuda:0""}`. Note that when passed from<br>command line, the strings in dictionary need to be<br>double quoted for json parsing. For more details, see<br>the original doc for `map_location` parameter in<br>[`torch.load`][] parameter.",LoadConfig
safetensors-load-strategy,str,None,,"Specifies the loading strategy for safetensors<br>weights.<br>- None (default): Uses memory-mapped (lazy) loading.<br>When an NFS filesystem is detected and the total<br>checkpoint size fits within 90%% of available RAM,<br>prefetching is enabled automatically.<br>- ""lazy"": Weights are memory-mapped from the file.<br>This enables on-demand loading and is highly efficient<br>for models on local storage. Unlike the default<br>(None), auto-prefetch on NFS is not performed.<br>- ""eager"": The entire file is read into CPU memory<br>upfront before loading. This is recommended for models<br>on network filesystems (e.g., Lustre, NFS) as it<br>avoids inefficient random reads, significantly<br>speeding up model initialization. However, it uses<br>more CPU RAM.<br>- ""prefetch"": Checkpoint files are read into the OS<br>page cache before workers load them, speeding up the<br>model loading phase. Useful on network or high-latency<br>storage.<br>- ""torchao"": Weights are loaded in upfront and then<br>reconstructed into torchao tensor subclasses. This is<br>used when the checkpoint was quantized using torchao<br>and saved using safetensors. Needs `torchao >=<br>0.14.0`.",LoadConfig
safetensors-prefetch-block-size,int,16777216,,"Read size in bytes for each safetensors checkpoint<br>file prefetch.<br>Parse human-readable integers like '1k', '2M', etc.<br>Including decimal values with decimal multipliers.<br>    Examples:<br>    - '1k' -> 1,000<br>    - '1K' -> 1,024<br>    - '25.6k' -> 25,600",LoadConfig
safetensors-prefetch-num-threads,int,8,,Number of worker threads used to prefetch safetensors<br>checkpoint files into the OS page cache when<br>safetensors prefetching is enabled.,LoadConfig
use-tqdm-on-load,Boolean flag,True,,Whether to enable tqdm for showing progress bar when<br>loading model weights.,LoadConfig
no-use-tqdm-on-load,Boolean flag,True,,Whether to enable tqdm for showing progress bar when<br>loading model weights.,LoadConfig
attention-backend,str,None,,"Attention backend to use. Use ""auto"" or None for<br>automatic selection.",AttentionConfig
backend,AttentionBackendEnum | None,None,,The backend to use for weight transfer during RL training.,AttentionConfig
flash_attn_version,"Literal[2, 3, 4] | None",None,,"Force vllm to use a specific flash-attention version (2, 3, or 4).",AttentionConfig
use_prefill_decode_attention,bool,False,,Use separate prefill and decode kernels for attention.,AttentionConfig
flash_attn_max_num_splits_for_cuda_graph,int,32,,Flash Attention max number of splits for CUDA graph decode.,AttentionConfig
tq_max_kv_splits_for_cuda_graph,int,32,,TurboQuant max NUM_KV_SPLITS for CUDA graph decode.,AttentionConfig
use_trtllm_attention,bool | None,None,,"If set to True/False, use or don't use the TRTLLM attention backend in flashinfer.",AttentionConfig
disable_flashinfer_q_quantization,bool,False,,"If set, when using fp8 kv, do not quantize Q to fp8.",AttentionConfig
mla_prefill_backend,MLAPrefillBackendEnum | None,None,,MLA prefill backend to use.,AttentionConfig
use_prefill_query_quantization,bool,False,,"If set, quantize query for attention in prefill.",AttentionConfig
use_fp4_indexer_cache,bool,False,,"If set, use fp4 indexer cache for DeepSeek V3.2 family models.",AttentionConfig
use_non_causal,bool,False,,Whether to use non-causal (bidirectional) attention.,AttentionConfig
flex_attn_block_m,int | None,None,,Triton kernel BLOCK_M tile size for flex attention.,AttentionConfig
flex_attn_block_n,int | None,None,,Triton kernel BLOCK_N tile size for flex attention.,AttentionConfig
flex_attn_q_block_size,int | None,None,,Logical Q block size for the flex attention block mask.,AttentionConfig
flex_attn_kv_block_size,int | None,None,,Logical KV block size for the flex attention block mask.,AttentionConfig
enable-mamba-cache-stochastic-rounding,Boolean flag,False,,"Enable stochastic rounding when writing SSM state to<br>fp16 cache. Uses random bits to unbias the rounding<br>error, which can improve numerical stability for long<br>sequences.",MambaConfig
no-enable-mamba-cache-stochastic-rounding,Boolean flag,False,,"Enable stochastic rounding when writing SSM state to<br>fp16 cache. Uses random bits to unbias the rounding<br>error, which can improve numerical stability for long<br>sequences.",MambaConfig
mamba-backend,str,MambaBackendEnum.TRITON,,Mamba SSU backend to use.,MambaConfig
mamba-cache-philox-rounds,int,0,,Number of Philox PRNG rounds for stochastic rounding<br>random number generation. 0 uses the Triton default.<br>Higher values improve randomness quality at the cost<br>of compute.,MambaConfig
reasoning-parser,str,(empty string),,Select the reasoning parser depending on the model<br>that you're using. This is used to parse the reasoning<br>content into OpenAI API format.,StructuredOutputsConfig
reasoning-parser-plugin,str,(empty string),,Path to a dynamically reasoning parser plugin that can<br>be dynamically loaded and registered.,StructuredOutputsConfig
all2all-backend,Enum,allgather_reducescatter,"allgather_reducescatter,deepep_high_throughput,deepep_low_latency,flashinfer_all2allv,flashinfer_nvlink_one_sided,flashinfer_nvlink_two_sided,mori_high_throughput,mori_low_latency,naive,nixl_ep,pplx","All2All backend for MoE expert parallel communication.<br>Available options:<br>- ""allgather_reducescatter"": All2all based on<br>allgather and reducescatter<br>- ""deepep_high_throughput"": Use deepep high-throughput<br>kernels<br>- ""deepep_low_latency"": Use deepep low-latency kernels<br>- ""mori_high_throughput"": MoRI EP with InterNodeV1 for<br>multi-node<br>- ""mori_low_latency"": MoRI EP with InterNodeV1LL for<br>multi-node<br>- ""nixl_ep"": Use nixl-ep kernels<br>- ""flashinfer_nvlink_two_sided"": Use flashinfer two-<br>sided kernels for mnnvl<br>- ""flashinfer_nvlink_one_sided"": Use flashinfer high-<br>throughput a2a kernels",ParallelConfig
cp-kv-cache-interleave-size,int,1,,"Interleave size of kv_cache storage while using DCP or<br>PCP. For `total_cp_rank = pcp_rank * dcp_world_size +<br>dcp_rank`, and `total_cp_world_size = pcp_world_size *<br>dcp_world_size`. store interleave_size tokens on<br>total_cp_rank i, then store next interleave_size<br>tokens on total_cp_rank i+1. Interleave_size=1: token-<br>level alignment, where token `i` is stored on<br>total_cp_rank `i % total_cp_world_size`.<br>Interleave_size=block_size: block-level alignment,<br>where tokens are first populated to the preceding<br>ranks. Tokens are then stored in (rank i+1, block j)<br>only after (rank i, block j) is fully occupied.<br>Block_size should be greater than or equal to<br>cp_kv_cache_interleave_size. Block_size should be<br>divisible by cp_kv_cache_interleave_size.",ParallelConfig
cpu-distributed-timeout-seconds,int,None,,"Timeout (in seconds) for cpu communication groups. If<br>None, PyTorch's default timeout is used (1800s for<br>gloo).",ParallelConfig
data-parallel-address,str,None,,Address of data parallel cluster head-node.,ParallelConfig
data-parallel-backend,str,mp,,"Backend for data parallel, either ""mp"" or ""ray"".",ParallelConfig
data-parallel-external-lb,Boolean flag,False,,"Whether to use ""external"" DP LB mode. Applies only to<br>online serving and when data_parallel_size > 0. This<br>is useful for a ""one-pod-per-rank"" wide-EP setup in<br>Kubernetes. Supported only for MoE deployments; non-<br>MoE models should use independent vLLM instances<br>without --data-parallel-* arguments. Set implicitly<br>when --data-parallel-rank is provided explicitly to<br>vllm serve.",ParallelConfig
no-data-parallel-external-lb,Boolean flag,False,,"Whether to use ""external"" DP LB mode. Applies only to<br>online serving and when data_parallel_size > 0. This<br>is useful for a ""one-pod-per-rank"" wide-EP setup in<br>Kubernetes. Supported only for MoE deployments; non-<br>MoE models should use independent vLLM instances<br>without --data-parallel-* arguments. Set implicitly<br>when --data-parallel-rank is provided explicitly to<br>vllm serve.",ParallelConfig
data-parallel-hybrid-lb,Boolean flag,False,,"Whether to use ""hybrid"" DP LB mode. Applies only to<br>online serving and when data_parallel_size > 0.<br>Enables running an AsyncLLM and API server on a ""per-<br>node"" basis where vLLM load balances between local<br>data parallel ranks, but an external LB balances<br>between vLLM nodes/replicas. Set explicitly in<br>conjunction with<br>--data-parallel-start-rank.",ParallelConfig
no-data-parallel-hybrid-lb,Boolean flag,False,,"Whether to use ""hybrid"" DP LB mode. Applies only to<br>online serving and when data_parallel_size > 0.<br>Enables running an AsyncLLM and API server on a ""per-<br>node"" basis where vLLM load balances between local<br>data parallel ranks, but an external LB balances<br>between vLLM nodes/replicas. Set explicitly in<br>conjunction with<br>--data-parallel-start-rank.",ParallelConfig
data-parallel-multi-port-external-lb,Boolean flag,False,,Run a node-local supervisor that launches one<br>external-LB API server per local data parallel rank<br>and exposes aggregated health on a supervisor port.,ParallelConfig
data-parallel-rank,int,None,,"Data parallel rank of this instance. When set, enables<br>external load balancer mode for MoE data-parallel<br>deployments. Unsupported for non-MoE models; launch<br>independent vLLM instances instead.",ParallelConfig
data-parallel-rpc-port,int,None,,Port for data parallel RPC communication.,ParallelConfig
data-parallel-size,int,1,,Number of data parallel groups. MoE layers will be<br>sharded according to the product of the tensor<br>parallel size and data parallel size.,ParallelConfig
data-parallel-size-local,int,None,,Number of data parallel replicas to run on this node.,ParallelConfig
data-parallel-start-rank,int,None,,Starting data parallel rank for secondary nodes.,ParallelConfig
dbo-decode-token-threshold,int,32,,"The threshold for dual batch overlap for batches only<br>containing decodes. If the number of tokens in the<br>request is greater than this threshold, microbatching<br>will be used. Otherwise, the request will be processed<br>in a single batch.",ParallelConfig
dbo-prefill-token-threshold,int,512,,"The threshold for dual batch overlap for batches that<br>contain one or more prefills. If the number of tokens<br>in the request is greater than this threshold,<br>microbatching will be used. Otherwise, the request<br>will be processed in a single batch.",ParallelConfig
dcp-comm-backend,Enum,ag_rs,"a2a,ag_rs","Communication backend for Decode Context Parallel<br>(DCP).<br>- ""ag_rs"": AllGather + ReduceScatter (default,<br>existing behavior)<br>- ""a2a"": All-to-All exchange of partial outputs + LSE,<br>then combine with Triton kernel. Reduces NCCL calls<br>from 3 to 2 per layer for MLA models.",ParallelConfig
dcp-kv-cache-interleave-size,int,1,,"Interleave size of kv_cache storage while using DCP.<br>dcp_kv_cache_interleave_size has been replaced by<br>cp_kv_cache_interleave_size, and will be deprecated<br>when PCP is fully supported.",ParallelConfig
decode-context-parallel-size,int,1,,"Number of decode context parallel groups, because the<br>world size does not change by dcp, it simply reuse the<br>GPUs of TP group, and tp_size needs to be divisible by<br>dcp_size.",ParallelConfig
disable-custom-all-reduce,Boolean flag,False,,Disable the custom all-reduce kernel and fall back to<br>NCCL.,ParallelConfig
no-disable-custom-all-reduce,Boolean flag,False,,Disable the custom all-reduce kernel and fall back to<br>NCCL.,ParallelConfig
disable-nccl-for-dp-synchronization,Boolean flag,None,,"Forces the dp synchronization logic in<br>vllm/v1/worker/dp_utils.py  to use Gloo instead of<br>NCCL for its all reduce.<br>Defaults to True when async scheduling is enabled,<br>False otherwise.",ParallelConfig
no-disable-nccl-for-dp-synchronization,Boolean flag,None,,"Forces the dp synchronization logic in<br>vllm/v1/worker/dp_utils.py  to use Gloo instead of<br>NCCL for its all reduce.<br>Defaults to True when async scheduling is enabled,<br>False otherwise.",ParallelConfig
distributed-executor-backend,Enum,None,"'external_launcher', 'mp', 'ray', 'uni'","Backend to use for distributed model workers, either<br>""ray"" or ""mp"" (multiprocessing). If the product of<br>pipeline_parallel_size and tensor_parallel_size is<br>less than or equal to the number of GPUs available,<br>""mp"" will be used to keep processing on a single host.<br>Otherwise, an error will be raised. To use ""mp"" you<br>must also set nnodes, and to use ""ray"" you must<br>manually set distributed_executor_backend to ""ray"".<br>Note:<br>[TPU](https://docs.vllm.ai/projects/tpu/en/latest/)<br>platform only supports Ray for distributed inference.",ParallelConfig
distributed-timeout-seconds,int,None,,"Timeout in seconds for distributed operations (e.g.,<br>init_process_group). If set, this value is passed to<br>torch.distributed.init_process_group as the timeout<br>parameter. If None, PyTorch's default timeout is used<br>(600s for NCCL). Increase this for multi-node setups<br>where model downloads may be slow.",ParallelConfig
enable-dbo,Boolean flag,False,,Enable dual batch overlap for the model executor.,ParallelConfig
no-enable-dbo,Boolean flag,False,,Enable dual batch overlap for the model executor.,ParallelConfig
enable-elastic-ep,Boolean flag,False,,Enable elastic expert parallelism with stateless NCCL<br>groups for DP/EP.,ParallelConfig
no-enable-elastic-ep,Boolean flag,False,,Enable elastic expert parallelism with stateless NCCL<br>groups for DP/EP.,ParallelConfig
enable-ep-weight-filter,Boolean flag,False,,"Skip non-local expert weights during model loading<br>when expert parallelism is active.  Each rank only<br>reads its own expert shard from disk, which can<br>drastically reduce storage I/O for MoE models with<br>per-expert weight tensors (e.g. DeepSeek, Mixtral,<br>Kimi-K2.5).  Has no effect on 3D fused-expert<br>checkpoints (e.g. GPT-OSS) or non-MoE models.",ParallelConfig
no-enable-ep-weight-filter,Boolean flag,False,,"Skip non-local expert weights during model loading<br>when expert parallelism is active.  Each rank only<br>reads its own expert shard from disk, which can<br>drastically reduce storage I/O for MoE models with<br>per-expert weight tensors (e.g. DeepSeek, Mixtral,<br>Kimi-K2.5).  Has no effect on 3D fused-expert<br>checkpoints (e.g. GPT-OSS) or non-MoE models.",ParallelConfig
enable-eplb,Boolean flag,False,,Enable expert parallelism load balancing for MoE<br>layers.,ParallelConfig
no-enable-eplb,Boolean flag,False,,Enable expert parallelism load balancing for MoE<br>layers.,ParallelConfig
enable-expert-parallel,Boolean flag,False,,Use expert parallelism instead of tensor parallelism<br>for MoE layers.,ParallelConfig
no-enable-expert-parallel,Boolean flag,False,,Use expert parallelism instead of tensor parallelism<br>for MoE layers.,ParallelConfig
eplb-config,dict (EPLBConfig),"EPLBConfig(window_size=1000, step_interval=3000,<br>num_redundant_experts=0, log_balancedness=False,<br>log_balancedness_interval=1, use_async=True,<br>policy='default', communicator=None)",,Expert parallelism configuration.<br>API docs: https://docs.vllm.ai/en/latest/api/vllm/conf<br>ig/#vllm.config.EPLBConfig<br>Should either be a valid JSON string or JSON keys<br>passed individually.,ParallelConfig
expert-placement-strategy,Enum,linear,"linear,round_robin","The expert placement strategy for MoE layers:<br>- ""linear"": Experts are placed in a contiguous manner.<br>For example, with 4 experts and 2 ranks, rank 0 will<br>have experts [0, 1] and rank 1 will have experts [2,<br>3].<br>- ""round_robin"": Experts are placed in a round-robin<br>manner. For example, with 4 experts and 2 ranks, rank<br>0 will have experts [0, 2] and rank 1 will have<br>experts [1, 3]. This strategy can help improve load<br>balancing for grouped expert models with no redundant<br>experts.",ParallelConfig
master-addr,str,127.0.0.1,,distributed master address for multi-node distributed<br>inference when distributed_executor_backend is mp.,ParallelConfig
master-port,int,29501,,distributed master port for multi-node distributed<br>inference when distributed_executor_backend is mp.,ParallelConfig
max-parallel-loading-workers,int,None,,Maximum number of parallel loading workers when<br>loading model sequentially in multiple batches. To<br>avoid RAM OOM when using tensor parallel and large<br>models.,ParallelConfig
nnodes,int,1,,num of nodes for multi-node distributed inference when<br>distributed_executor_backend is mp.,ParallelConfig
node-rank,int,0,,distributed node rank for multi-node distributed<br>inference when distributed_executor_backend is mp.,ParallelConfig
numa-bind,Boolean flag,False,,"Enable NUMA binding for GPU worker subprocesses.<br>By default, workers are pinned to their GPU's NUMA-<br>local CPUs and memory; on PCT-capable Xeons they also<br>auto-bind to the SKU's PCT priority cores.",ParallelConfig
no-numa-bind,Boolean flag,False,,"Enable NUMA binding for GPU worker subprocesses.<br>By default, workers are pinned to their GPU's NUMA-<br>local CPUs and memory; on PCT-capable Xeons they also<br>auto-bind to the SKU's PCT priority cores.",ParallelConfig
numa-bind-cpus,List,None,,"Optional CPU lists to bind each GPU worker to.<br>Specify one CPU list per visible GPU, for example<br>`[""0-3"", ""4-7"", ""8-11"", ""12-15""]`. When set, vLLM uses<br>`numactl --physcpubind` instead of `--cpunodebind`.<br>This is useful for custom policies such as binding to<br>PCT or other high-frequency cores. Each entry must use<br>`numactl --physcpubind` CPU-list syntax, for example<br>`""0-3""` or `""0,2,4-7""`.",ParallelConfig
numa-bind-nodes,List,None,,"NUMA node to bind each GPU worker to.<br>Specify one NUMA node per visible GPU, for example<br>`[0, 0, 1, 1]` for a 4-GPU system with GPUs 0-1 on<br>NUMA node 0 and GPUs 2-3 on NUMA node 1. If unset and<br>`numa_bind=True`, vLLM auto-detects the GPU-to-NUMA<br>topology. The values are passed to `numactl --membind`<br>and `--cpunodebind`, so they must be valid `numactl`<br>NUMA node indices.",ParallelConfig
pipeline-parallel-size,int,1,,Number of pipeline parallel groups.,ParallelConfig
prefill-context-parallel-size,int,1,,Number of prefill context parallel groups.,ParallelConfig
ray-workers-use-nsight,Boolean flag,False,,"Whether to profile Ray workers with nsight, see<br>https://docs.ray.io/en/latest/ray-observability/user-<br>guides/profiling.html#profiling-nsight-profiler.",ParallelConfig
no-ray-workers-use-nsight,Boolean flag,False,,"Whether to profile Ray workers with nsight, see<br>https://docs.ray.io/en/latest/ray-observability/user-<br>guides/profiling.html#profiling-nsight-profiler.",ParallelConfig
tensor-parallel-size,int,1,,Number of tensor parallel groups.,ParallelConfig
ubatch-size,int,0,,Number of ubatch size.,ParallelConfig
worker-cls,str,auto,,"The full name of the worker class to use. If ""auto"",<br>the worker class will be determined based on the<br>platform.",ParallelConfig
worker-extension-cls,str,(empty string),,The full name of the worker extension class to use.<br>The worker extension class is dynamically inherited by<br>the worker class. This is used to inject new<br>attributes and methods to the worker class for use in<br>collective_rpc calls.,ParallelConfig
window_size,int,1000,,Window size for expert load recording.,EPLBConfig
step_interval,int,3000,,Interval for rearranging experts in expert parallelism.,EPLBConfig
num_redundant_experts,int,0,,Number of redundant experts to use for expert parallelism.,EPLBConfig
log_balancedness,bool,False,,Log the balancedness each step of expert parallelism.,EPLBConfig
log_balancedness_interval,int,1,,Interval for logging the balancedness.,EPLBConfig
use_async,bool,True,,Whether to use non-blocking EPLB.,EPLBConfig
policy,EPLBPolicyOption,"""default""",,The policy type for expert parallel load balancing (EPLB).,EPLBConfig
communicator,EPLBCommunicatorBackend | None,None,,"Backend for EPLB expert weight communication: 'torch_nccl', 'torch_gloo', 'nixl', 'pynccl', or None (auto-select).",EPLBConfig
block-size,int,None,,"Size of a contiguous cache block in number of tokens.<br>Accepts None (meaning ""use default""). After<br>construction, always int.",CacheConfig
calculate-kv-scales,Boolean flag,False,,"Deprecated: This option is deprecated and will be<br>removed in v0.19. It enables dynamic calculation of<br>`k_scale` and `v_scale` when kv_cache_dtype is fp8. If<br>`False`, the scales will be loaded from the model<br>checkpoint if available. Otherwise, the scales will<br>default to 1.0.",CacheConfig
no-calculate-kv-scales,Boolean flag,False,,"Deprecated: This option is deprecated and will be<br>removed in v0.19. It enables dynamic calculation of<br>`k_scale` and `v_scale` when kv_cache_dtype is fp8. If<br>`False`, the scales will be loaded from the model<br>checkpoint if available. Otherwise, the scales will<br>default to 1.0.",CacheConfig
enable-prefix-caching,Boolean flag,None,,Whether to enable prefix caching.,CacheConfig
no-enable-prefix-caching,Boolean flag,None,,Whether to enable prefix caching.,CacheConfig
gpu-memory-utilization,float,0.92,,"The fraction of GPU memory to be used for the model<br>executor, which can range from 0 to 1. For example, a<br>value of 0.5 would imply 50% GPU memory utilization.<br>If unspecified, will use the default value of 0.92.<br>This is a per-instance limit, and only applies to the<br>current vLLM instance. It does not matter if you have<br>another vLLM instance running on the same GPU. For<br>example, if you have two vLLM instances running on the<br>same GPU, you can set the GPU memory utilization to<br>0.5 for each instance.",CacheConfig
kv-cache-dtype,Enum,auto,"auto,bfloat16,float16,fp8,fp8_ds_mla,fp8_e4m3,fp8_e5m2,fp8_inc,fp8_per_token_head,int8_per_token_head,nvfp4,turboquant_3bit_nc,turboquant_4bit_nc,turboquant_k3v4_nc,turboquant_k8v4","Data type for kv cache storage. If ""auto"", will use<br>model data type. CUDA 11.8+ supports fp8 (=fp8_e4m3)<br>and fp8_e5m2. ROCm (AMD GPU) supports fp8 (=fp8_e4m3).<br>Intel Gaudi (HPU) supports fp8 (using fp8_inc). Some<br>models (namely DeepSeekV3.2) default to fp8, set to<br>bfloat16 to use bfloat16 instead, this is an invalid<br>option for models that do not default to fp8.",CacheConfig
kv-cache-dtype-skip-layers,List,[],,"Layer patterns to skip KV cache quantization. Accepts<br>layer indices (e.g., '0', '2', '4') or attention type<br>names (e.g., 'sliding_window').",CacheConfig
