Name,Type,Default,Choices,Description,Config
kv-cache-memory-bytes,int,None,,"Size of KV Cache per GPU in bytes. By default, this is<br>set to None and vllm can automatically infer the kv<br>cache size based on gpu_memory_utilization. However,<br>users may want to manually specify the kv cache memory<br>size. kv_cache_memory_bytes allows more fine-grain<br>control of how much memory gets used when compared<br>with using gpu_memory_utilization. Note that<br>kv_cache_memory_bytes (when not-None) ignores<br>gpu_memory_utilization<br>Parse human-readable integers like '1k', '2M', etc.<br>Including decimal values with decimal multipliers.<br>    Examples:<br>    - '1k' -> 1,000<br>    - '1K' -> 1,024<br>    - '25.6k' -> 25,600",CacheConfig
kv-offloading-backend,Enum,native,"lmcache,native","The backend to use for KV cache offloading. Supported<br>backends include 'native' (vLLM native CPU<br>offloading), 'lmcache'. KV offloading is only<br>activated when kv_offloading_size is set.",CacheConfig
kv-offloading-size,float,None,,"Size of the KV cache offloading buffer in GiB. When TP<br>> 1, this is the total buffer size summed across all<br>TP ranks. By default, this is set to None, which means<br>no KV offloading is enabled. When set, vLLM will<br>enable KV cache offloading to CPU using the<br>kv_offloading_backend.",CacheConfig
kv-sharing-fast-prefill,Boolean flag,False,,"This feature is work in progress and no prefill<br>optimization takes place with this flag enabled<br>currently.<br>In some KV sharing setups, e.g. YOCO<br>(https://arxiv.org/abs/2405.05254), some layers can<br>skip tokens corresponding to prefill. This flag<br>enables attention metadata for eligible layers to be<br>overridden with metadata necessary for implementing<br>this optimization in some models (e.g. Gemma3n)",CacheConfig
no-kv-sharing-fast-prefill,Boolean flag,False,,"This feature is work in progress and no prefill<br>optimization takes place with this flag enabled<br>currently.<br>In some KV sharing setups, e.g. YOCO<br>(https://arxiv.org/abs/2405.05254), some layers can<br>skip tokens corresponding to prefill. This flag<br>enables attention metadata for eligible layers to be<br>overridden with metadata necessary for implementing<br>this optimization in some models (e.g. Gemma3n)",CacheConfig
mamba-block-size,int,None,,Size of a contiguous cache block in number of tokens<br>for mamba cache. Can be set only when prefix caching<br>is enabled. Value must be a multiple of 8 to align<br>with causal_conv1d kernel.,CacheConfig
mamba-cache-dtype,Enum,auto,"auto,bfloat16,float16,float32","The data type to use for the Mamba cache (both the<br>conv as well as the ssm state). If set to 'auto', the<br>data type will be inferred from the model config.",CacheConfig
mamba-cache-mode,Enum,none,"align,all,none","The cache strategy for Mamba layers.<br>- ""none"": set when prefix caching is disabled.<br>- ""all"": cache the mamba state of all tokens at<br>position i * block_size. This is the default behavior<br>(for models that support it) when prefix caching is<br>enabled.<br>- ""align"": only cache the mamba state of the last<br>token of each scheduler step and when the token is at<br>position i * block_size.",CacheConfig
mamba-ssm-cache-dtype,Enum,auto,"auto,bfloat16,float16,float32","The data type to use for the Mamba cache (ssm state<br>only, conv state will still be controlled by<br>mamba_cache_dtype). If set to 'auto', the data type<br>for the ssm state will be determined by<br>mamba_cache_dtype.",CacheConfig
num-gpu-blocks-override,int,None,,Number of GPU blocks to use. This overrides the<br>profiled `num_gpu_blocks` if specified. Does nothing<br>if `None`. Used for testing preemption.,CacheConfig
prefix-caching-hash-algo,Enum,sha256,"sha256,sha256_cbor,xxhash,xxhash_cbor","Set the hash algorithm for prefix caching:<br>- ""sha256"" uses Pickle for object serialization before<br>hashing. This is the current default, as SHA256 is the<br>most secure choice to avoid potential hash collisions.<br>- ""sha256_cbor"" provides a reproducible, cross-<br>language compatible hash. It serializes objects using<br>canonical CBOR and hashes them with SHA-256.<br>- ""xxhash"" uses Pickle serialization with xxHash<br>(128-bit) for faster, non-cryptographic hashing.<br>Requires the optional ``xxhash`` package. IMPORTANT:<br>Use of a hashing algorithm that is not considered<br>cryptographically secure theoretically increases the<br>risk of hash collisions, which can cause undefined<br>behavior or even leak private information in multi-<br>tenant environments. Even if collisions are still very<br>unlikely, it is important to consider your security<br>risk tolerance against the performance benefits before<br>turning this on.<br>- ""xxhash_cbor"" combines canonical CBOR serialization<br>with xxHash for reproducible hashing. Requires the<br>optional ``xxhash`` package.",CacheConfig
cpu-offload-gb,float,0,,"The space in GiB to offload to CPU, per GPU. Default<br>is 0, which means no offloading. Intuitively, this<br>argument can be seen as a virtual way to increase the<br>GPU memory size. For example, if you have one 24 GB<br>GPU and set this to 10, virtually you can think of it<br>as a 34 GB GPU. Then you can load a 13B model with<br>BF16 weight, which requires at least 26GB GPU memory.<br>Note that this requires fast CPU-GPU interconnect, as<br>part of the model is loaded from CPU memory to GPU<br>memory on the fly in each model forward pass. This<br>uses UVA (Unified Virtual Addressing) for zero-copy<br>access.",OffloadConfig
cpu-offload-params,List,set(),,"The set of parameter name segments to target for CPU<br>offloading. Unmatched parameters are not offloaded. If<br>this set is empty, parameters are offloaded non-<br>selectively until the memory limit defined by<br>`cpu_offload_gb` is reached. Examples:<br>    - For parameter name ""mlp.experts.w2_weight"":<br>        - ""experts"" or ""experts.w2_weight"" will match.<br>        - ""expert"" or ""w2"" will NOT match (must be<br>exact segments). This allows distinguishing parameters<br>like ""w2_weight"" and ""w2_weight_scale"".",OffloadConfig
offload-backend,Enum,auto,"auto,prefetch,uva","The backend for weight offloading. Options:<br>- ""auto"": Selects based on which sub-config has non-<br>default values (prefetch if offload_group_size > 0,<br>uva if cpu_offload_gb > 0).<br>- ""uva"": UVA (Unified Virtual Addressing) zero-copy<br>offloading.<br>- ""prefetch"": Async prefetch with group-based layer<br>offloading.",OffloadConfig
offload-group-size,int,0,,"Group every N layers together. Offload last<br>`offload_num_in_group` layers of each group. Default<br>is 0 (disabled). Example: group_size=8, num_in_group=2<br>offloads layers 6,7,14,15,22,23,... Unlike<br>cpu_offload_gb, this uses explicit async prefetching<br>to hide transfer latency.",OffloadConfig
offload-num-in-group,int,1,,Number of layers to offload per group. Must be <=<br>offload_group_size. Default is 1.,OffloadConfig
offload-params,List,set(),,"The set of parameter name segments to target for<br>prefetch offloading. Unmatched parameters are not<br>offloaded. If this set is empty, ALL parameters of<br>each offloaded layer are offloaded. Uses segment<br>matching: ""w13_weight"" matches<br>""mlp.experts.w13_weight"" but not<br>""mlp.experts.w13_weight_scale"".",OffloadConfig
offload-prefetch-step,int,1,,Number of layers to prefetch ahead. Higher values hide<br>more latency but use more GPU memory. Default is 1.,OffloadConfig
enable-mm-embeds,Boolean flag,False,,"If `True`, enables passing multimodal embeddings: for<br>`LLM` class, this refers to tensor inputs under<br>`multi_modal_data`; for the OpenAI-compatible server,<br>this refers to chat messages with content `""type"":<br>""*_embeds""`.<br>When enabled with `--limit-mm-per-prompt` set to 0 for<br>a modality, precomputed embeddings skip count<br>validation for that modality,  saving memory by not<br>loading encoder modules while still enabling<br>embeddings as an input. Limits greater than 0 still<br>apply to embeddings.<br>WARNING: The vLLM engine may crash if incorrect shape<br>of embeddings is passed. Only enable this flag for<br>trusted users!",MultiModalConfig
no-enable-mm-embeds,Boolean flag,False,,"If `True`, enables passing multimodal embeddings: for<br>`LLM` class, this refers to tensor inputs under<br>`multi_modal_data`; for the OpenAI-compatible server,<br>this refers to chat messages with content `""type"":<br>""*_embeds""`.<br>When enabled with `--limit-mm-per-prompt` set to 0 for<br>a modality, precomputed embeddings skip count<br>validation for that modality,  saving memory by not<br>loading encoder modules while still enabling<br>embeddings as an input. Limits greater than 0 still<br>apply to embeddings.<br>WARNING: The vLLM engine may crash if incorrect shape<br>of embeddings is passed. Only enable this flag for<br>trusted users!",MultiModalConfig
interleave-mm-strings,Boolean flag,False,,"Enable fully interleaved support for multimodal<br>prompts, while using<br>--chat-template-content-format=string.",MultiModalConfig
no-interleave-mm-strings,Boolean flag,False,,"Enable fully interleaved support for multimodal<br>prompts, while using<br>--chat-template-content-format=string.",MultiModalConfig
language-model-only,Boolean flag,False,,"If True, disables all multimodal inputs by setting all<br>modality limits to 0. Equivalent to setting `--limit-<br>mm-per-prompt` to 0 for every modality.",MultiModalConfig
no-language-model-only,Boolean flag,False,,"If True, disables all multimodal inputs by setting all<br>modality limits to 0. Equivalent to setting `--limit-<br>mm-per-prompt` to 0 for every modality.",MultiModalConfig
limit-mm-per-prompt,dict,{},,"The maximum number of input items and options allowed<br>per prompt for each modality.<br>Defaults to 999 for each modality.<br>Legacy format (count only): {""image"": 16, ""video"": 2}<br>Configurable format (with options): {""video"":<br>{""count"": 1, ""num_frames"": 32, ""width"": 512, ""height"":<br>512}, ""image"": {""count"": 5, ""width"": 512, ""height"":<br>512}}<br>Mixed format (combining both): {""image"": 16, ""video"":<br>{""count"": 1, ""num_frames"": 32, ""width"": 512, ""height"":<br>512}}<br>Should either be a valid JSON string or JSON keys<br>passed individually.",MultiModalConfig
media-io-kwargs,dict,{},,"Additional args passed to process media inputs, keyed<br>by modalities. For example, to set num_frames for<br>video, set `--media-io-kwargs '{""video"":<br>{""num_frames"": 40} }'`<br>Should either be a valid JSON string or JSON keys<br>passed individually.",MultiModalConfig
mm-encoder-attn-backend,str,None,,Optional override for the multi-modal encoder<br>attention backend when using vision transformers.<br>Accepts any value from `vllm.v1.attention.backends.reg<br>istry.AttentionBackendEnum` (e.g. `FLASH_ATTN`).,MultiModalConfig
mm-encoder-attn-dtype,Enum,None,"fp8,None","Optional dtype override for ViT encoder attention. Set<br>to `""fp8""` to enable FP8 quantization via the<br>FlashInfer cuDNN backend. When set to `""fp8""` without<br>a scale file, dynamic scaling is used automatically.<br>See docs/features/quantization/fp8_vit_attn.md for<br>details.",MultiModalConfig
mm-encoder-fp8-scale-path,str (file path),None,,"Path to a JSON file containing per-layer FP8 Q/K/V<br>scales for ViT encoder attention. When provided (with<br>`mm_encoder_attn_dtype=""fp8""`), static scaling is<br>used. When omitted, dynamic scaling is used.",MultiModalConfig
mm-encoder-fp8-scale-save-margin,float,1.5,,Safety margin multiplied onto scales when auto-saving.<br>A value > 1 leaves headroom so that inputs with larger<br>activations than the calibration set do not overflow<br>FP8 range. Default 1.5.,MultiModalConfig
mm-encoder-fp8-scale-save-path,str (file path),None,,"When set with dynamic FP8 scaling<br>(`mm_encoder_attn_dtype=""fp8""` and no<br>`mm_encoder_fp8_scale_path`), saves the calibrated<br>scales to this file after the amax history buffer is<br>full. The saved file can then be used as<br>`mm_encoder_fp8_scale_path` in subsequent runs.",MultiModalConfig
mm-encoder-only,Boolean flag,False,,"When enabled, skips the language component of the<br>model.<br>This is usually only valid in disaggregated Encoder<br>process.",MultiModalConfig
no-mm-encoder-only,Boolean flag,False,,"When enabled, skips the language component of the<br>model.<br>This is usually only valid in disaggregated Encoder<br>process.",MultiModalConfig
mm-encoder-tp-mode,Enum,weights,"data,weights","Indicates how to optimize multi-modal encoder<br>inference using tensor parallelism (TP).<br>- `""weights""`: Within the same vLLM engine, split the<br>weights of each layer across TP ranks. (default TP<br>behavior)<br>- `""data""`: Within the same vLLM engine, split the<br>batched input data across TP ranks to process the data<br>in parallel, while hosting the full weights on each TP<br>rank. This batch-level DP is not to be confused with<br>API request-level DP (which is controlled by `--data-<br>parallel-size`). This is only supported on a per-model<br>basis and falls back to `""weights""` if the encoder<br>does not support DP.",MultiModalConfig
mm-processor-cache-gb,float,4,,"The size (in GiB) of the multi-modal processor cache,<br>which is used to avoid re-processing past multi-modal<br>inputs.<br>This cache is duplicated for each API process and<br>engine core process, resulting in a total memory usage<br>of `mm_processor_cache_gb * (api_server_count +<br>data_parallel_size)`.<br>Set to `0` to disable this cache completely (not<br>recommended).",MultiModalConfig
mm-processor-cache-type,Enum,lru,"lru,shm","Type of cache to use for the multi-modal<br>preprocessor/mapper. If `shm`, use shared memory FIFO<br>cache. If `lru`, use mirrored LRU cache.",MultiModalConfig
mm-processor-kwargs,dict,None,,"Arguments to be forwarded to the model's processor for<br>multi-modal data, e.g., image processor. Overrides for<br>the multi-modal processor obtained from<br>`transformers.AutoProcessor.from_pretrained`.<br>The available overrides depend on the model that is<br>being run.<br>For example, for Phi-3-Vision: `{""num_crops"": 4}`.<br>Should either be a valid JSON string or JSON keys<br>passed individually.",MultiModalConfig
mm-shm-cache-max-object-size-mb,int,128,,"Size limit (in MiB) for each object stored in the<br>multi-modal processor shared memory cache. Only<br>effective when `mm_processor_cache_type` is `""shm""`.",MultiModalConfig
mm-tensor-ipc,Enum,direct_rpc,"direct_rpc,torch_shm","IPC (inter-process communication) method for<br>multimodal tensors.<br>- ""direct_rpc"": Use msgspec serialization via RPC<br>- ""torch_shm"": Use torch.multiprocessing shared memory<br>for zero-copy IPC Defaults to ""direct_rpc"".",MultiModalConfig
skip-mm-profiling,Boolean flag,False,,"When enabled, skips multimodal memory profiling and<br>only profiles with language backbone model during<br>engine initialization.<br>This reduces engine startup time but shifts the<br>responsibility to users for estimating the peak memory<br>usage of the activation of multimodal encoder and<br>embedding cache.",MultiModalConfig
no-skip-mm-profiling,Boolean flag,False,,"When enabled, skips multimodal memory profiling and<br>only profiles with language backbone model during<br>engine initialization.<br>This reduces engine startup time but shifts the<br>responsibility to users for estimating the peak memory<br>usage of the activation of multimodal encoder and<br>embedding cache.",MultiModalConfig
video-pruning-rate,float,None,,Sets pruning rate for video pruning via Efficient<br>Video Sampling. Value sits in range [0;1) and<br>determines fraction of media tokens from each video to<br>be pruned.,MultiModalConfig
default-mm-loras,dict,None,,"Dictionary mapping specific modalities to LoRA model<br>paths; this field is only applicable to multimodal<br>models and should be leveraged when a model always<br>expects a LoRA to be active when a given modality is<br>present. Note that currently, if a request provides<br>multiple additional modalities, each of which have<br>their own LoRA, we do NOT apply default_mm_loras<br>because we currently only support one lora adapter per<br>prompt. When run in offline mode, the lora IDs for n<br>modalities will be automatically assigned to 1-n with<br>the names of the modalities in alphabetic order.<br>Should either be a valid JSON string or JSON keys<br>passed individually.",LoRAConfig
enable-lora,Boolean flag,None,,"If True, enable handling of LoRA adapters.",LoRAConfig
no-enable-lora,Boolean flag,None,,"If True, enable handling of LoRA adapters.",LoRAConfig
enable-mixed-moe-lora-format,Boolean flag,False,,"If True, force the engine to use the universal 2D MoE<br>LoRA wrapper (`FusedMoEWithLoRA`) regardless of the<br>model's `is_3d_moe_weight` flag, so that 2D-format and<br>3D-format MoE LoRA adapters can be served in the same<br>deployment. Only meaningful forMoE models; ignored<br>otherwise. Default False  keeps the existing model-<br>driven behavior.",LoRAConfig
no-enable-mixed-moe-lora-format,Boolean flag,False,,"If True, force the engine to use the universal 2D MoE<br>LoRA wrapper (`FusedMoEWithLoRA`) regardless of the<br>model's `is_3d_moe_weight` flag, so that 2D-format and<br>3D-format MoE LoRA adapters can be served in the same<br>deployment. Only meaningful forMoE models; ignored<br>otherwise. Default False  keeps the existing model-<br>driven behavior.",LoRAConfig
enable-tower-connector-lora,Boolean flag,False,,"If `True`, LoRA support for the tower (vision encoder)<br>and connector  of multimodal models will be enabled.<br>This is an experimental feature and  currently only<br>supports some MM models such as the Qwen VL series.<br>The default  is False.",LoRAConfig
no-enable-tower-connector-lora,Boolean flag,False,,"If `True`, LoRA support for the tower (vision encoder)<br>and connector  of multimodal models will be enabled.<br>This is an experimental feature and  currently only<br>supports some MM models such as the Qwen VL series.<br>The default  is False.",LoRAConfig
fully-sharded-loras,Boolean flag,False,,"By default, only half of the LoRA computation is<br>sharded with tensor parallelism. Enabling this will<br>use the fully sharded layers. At high sequence length,<br>max rank or tensor parallel size, this is likely<br>faster.",LoRAConfig
no-fully-sharded-loras,Boolean flag,False,,"By default, only half of the LoRA computation is<br>sharded with tensor parallelism. Enabling this will<br>use the fully sharded layers. At high sequence length,<br>max rank or tensor parallel size, this is likely<br>faster.",LoRAConfig
lora-dtype,Enum,auto,"auto,bfloat16,float16","Data type for LoRA. If auto, will default to base<br>model dtype.",LoRAConfig
lora-target-modules,List,None,,"Restrict LoRA to specific module suffixes (e.g.,<br>[""o_proj"", ""qkv_proj""]). If None, all supported LoRA<br>modules are used. This allows deployment-time control<br>over which modules have LoRA applied, useful for<br>performance tuning.",LoRAConfig
max-cpu-loras,int,None,,Maximum number of LoRAs to store in CPU memory. Must<br>be >= than `max_loras`.,LoRAConfig
max-lora-rank,Enum,16,"1,8,16,32,64,128,256,320,512",Max LoRA rank.,LoRAConfig
max-loras,int,1,,Max number of LoRAs in a single batch.,LoRAConfig
specialize-active-lora,Boolean flag,False,,"Whether to construct lora kernel grid by the number of<br>active LoRA adapters. When set to True, separate cuda<br>graphs will be captured for different counts of active<br>LoRAs (powers of 2 up to max_loras), which can improve<br>performance for variable LoRA usage patterns at the<br>cost of increased startup time and memory usage. Only<br>takes effect when cudagraph_specialize_lora is True.",LoRAConfig
no-specialize-active-lora,Boolean flag,False,,"Whether to construct lora kernel grid by the number of<br>active LoRA adapters. When set to True, separate cuda<br>graphs will be captured for different counts of active<br>LoRAs (powers of 2 up to max_loras), which can improve<br>performance for variable LoRA usage patterns at the<br>cost of increased startup time and memory usage. Only<br>takes effect when cudagraph_specialize_lora is True.",LoRAConfig
collect-detailed-traces,List,None,"all,model,worker,None","It makes sense to set this only if `--otlp-traces-<br>endpoint` is set. If set, it will collect detailed<br>traces for the specified modules. This involves use of<br>possibly costly and or blocking operations and hence<br>might have a performance impact.<br>Note that collecting detailed timing information for<br>each request can be expensive.",ObservabilityConfig
cudagraph-metrics,Boolean flag,False,,"Enable CUDA graph metrics (number of padded/unpadded<br>tokens, runtime cudagraph dispatch modes, and their<br>observed frequencies at every logging interval).",ObservabilityConfig
no-cudagraph-metrics,Boolean flag,False,,"Enable CUDA graph metrics (number of padded/unpadded<br>tokens, runtime cudagraph dispatch modes, and their<br>observed frequencies at every logging interval).",ObservabilityConfig
enable-layerwise-nvtx-tracing,Boolean flag,False,,Enable layerwise NVTX tracing. This traces the<br>execution of each layer or module in the model and<br>attach information such as input/output shapes to nvtx<br>range markers. Noted that this doesn't work with CUDA<br>graphs enabled.,ObservabilityConfig
no-enable-layerwise-nvtx-tracing,Boolean flag,False,,Enable layerwise NVTX tracing. This traces the<br>execution of each layer or module in the model and<br>attach information such as input/output shapes to nvtx<br>range markers. Noted that this doesn't work with CUDA<br>graphs enabled.,ObservabilityConfig
enable-logging-iteration-details,Boolean flag,False,,"Enable detailed logging of iteration details. If set,<br>vllm EngineCore will log iteration details This<br>includes number of context/generation requests and<br>tokens and the elapsed cpu time for the iteration.",ObservabilityConfig
no-enable-logging-iteration-details,Boolean flag,False,,"Enable detailed logging of iteration details. If set,<br>vllm EngineCore will log iteration details This<br>includes number of context/generation requests and<br>tokens and the elapsed cpu time for the iteration.",ObservabilityConfig
enable-mfu-metrics,Boolean flag,False,,Enable Model FLOPs Utilization (MFU) metrics.,ObservabilityConfig
no-enable-mfu-metrics,Boolean flag,False,,Enable Model FLOPs Utilization (MFU) metrics.,ObservabilityConfig
kv-cache-metrics,Boolean flag,False,,"Enable KV cache residency metrics (lifetime, idle<br>time, reuse gaps). Uses sampling to minimize overhead.<br>Requires log stats to be enabled (i.e., --disable-log-<br>stats not set).",ObservabilityConfig
no-kv-cache-metrics,Boolean flag,False,,"Enable KV cache residency metrics (lifetime, idle<br>time, reuse gaps). Uses sampling to minimize overhead.<br>Requires log stats to be enabled (i.e., --disable-log-<br>stats not set).",ObservabilityConfig
kv-cache-metrics-sample,float,0.01,,"Sampling rate for KV cache metrics (0.0, 1.0]. Default<br>0.01 = 1% of blocks.",ObservabilityConfig
otlp-traces-endpoint,str,None,,Target URL to which OpenTelemetry traces will be sent.,ObservabilityConfig
show-hidden-metrics-for-version,str,None,,"Enable deprecated Prometheus metrics that have been<br>hidden since the specified version. For example, if a<br>previously deprecated metric has been hidden since the<br>v0.7.0 release, you use `--show-hidden-metrics-for-<br>version=0.7` as a temporary escape hatch while you<br>migrate to new metrics. The metric is likely to be<br>removed completely in an upcoming release.",ObservabilityConfig
async-scheduling,Boolean flag,None,,"If set to False, disable async scheduling. Async<br>scheduling helps to avoid gaps in GPU utilization,<br>leading to better latency and throughput.",SchedulerConfig
no-async-scheduling,Boolean flag,None,,"If set to False, disable async scheduling. Async<br>scheduling helps to avoid gaps in GPU utilization,<br>leading to better latency and throughput.",SchedulerConfig
disable-chunked-mm-input,Boolean flag,False,,"If set to true and chunked prefill is enabled, we do<br>not want to partially schedule a multimodal item. Only<br>used in V1 This ensures that if a request has a mixed<br>prompt (like text tokens TTTT followed by image tokens<br>IIIIIIIIII) where only some image tokens can be<br>scheduled (like TTTTIIIII, leaving IIIII), it will be<br>scheduled as TTTT in one step and IIIIIIIIII in the<br>next.",SchedulerConfig
no-disable-chunked-mm-input,Boolean flag,False,,"If set to true and chunked prefill is enabled, we do<br>not want to partially schedule a multimodal item. Only<br>used in V1 This ensures that if a request has a mixed<br>prompt (like text tokens TTTT followed by image tokens<br>IIIIIIIIII) where only some image tokens can be<br>scheduled (like TTTTIIIII, leaving IIIII), it will be<br>scheduled as TTTT in one step and IIIIIIIIII in the<br>next.",SchedulerConfig
disable-hybrid-kv-cache-manager,Boolean flag,None,,"If set to True, KV cache manager will allocate the<br>same size of KV cache for all attention layers even if<br>there are multiple type of attention layers like full<br>attention and sliding window attention. If set to<br>None, the default value will be determined based on<br>the environment and starting configuration.",SchedulerConfig
no-disable-hybrid-kv-cache-manager,Boolean flag,None,,"If set to True, KV cache manager will allocate the<br>same size of KV cache for all attention layers even if<br>there are multiple type of attention layers like full<br>attention and sliding window attention. If set to<br>None, the default value will be determined based on<br>the environment and starting configuration.",SchedulerConfig
