Name,Type,Default,Choices,Description,Config
model_tag,str,None,,The model tag to serve (optional if specified in<br>config),Positional Arguments
aggregate-engine-logging,Boolean flag,False,,Log aggregate rather than per-engine statistics when<br>using data parallelism.,Global Options
api-server-count,int,None,,How many API server processes to run. Defaults to<br>data_parallel_size if not specified.,Global Options
config,str (file path),None,,Read CLI options from a config file. Must be a YAML<br>with the following options: https://docs.vllm.ai/en/la<br>test/configuration/serve_args.html,Global Options
disable-log-stats,Boolean flag,False,,Disable logging statistics.,Global Options
enable-log-requests,Boolean flag,False,,"Enable logging request information, dependent on log<br>level:<br>- INFO: Request ID, parameters and LoRA request.<br>- DEBUG: Prompt inputs (e.g: text, token IDs). You can<br>set the minimum log level via `VLLM_LOGGING_LEVEL`.",Global Options
no-enable-log-requests,Boolean flag,False,,"Enable logging request information, dependent on log<br>level:<br>- INFO: Request ID, parameters and LoRA request.<br>- DEBUG: Prompt inputs (e.g: text, token IDs). You can<br>set the minimum log level via `VLLM_LOGGING_LEVEL`.",Global Options
fail-on-environ-validation,Boolean flag,False,,"If set, the engine will raise an error if environment<br>validation fails.",Global Options
no-fail-on-environ-validation,Boolean flag,False,,"If set, the engine will raise an error if environment<br>validation fails.",Global Options
gdn-prefill-backend,Enum,None,"flashinfer,triton,cutedsl",Select GDN prefill backend.,Global Options
grpc,Boolean flag,False,,Launch a gRPC server instead of the HTTP OpenAI-<br>compatible server. Requires: pip install vllm[grpc].,Global Options
headless,Boolean flag,False,,Run in headless mode. See multi-node data parallel<br>documentation for more details.,Global Options
shutdown-timeout,int,0,,"Shutdown timeout in seconds. 0 = abort, >0 = wait.",Global Options
"h, --help",Boolean flag,None,,show this help message and exit,Global Options
allow-credentials,Boolean flag,False,,Allow credentials.,Frontend
no-allow-credentials,Boolean flag,False,,Allow credentials.,Frontend
allowed-headers,list[str],['*'],,Allowed headers.,Frontend
allowed-methods,list[str],['*'],,Allowed methods.,Frontend
allowed-origins,list[str],['*'],,Allowed origins.,Frontend
api-key,List,None,,"If provided, the server will require one of these keys<br>to be presented in the header.",Frontend
chat-template,str,None,,N/A,Frontend
chat-template-content-format,Enum,None,"auto,openai,string",N/A,Frontend
data-parallel-supervisor-port,int,9256,,HTTP port for aggregated health endpoints in multi-<br>port external LB mode.,Frontend
default-chat-template-kwargs,dict,None,,Should either be a valid JSON string or JSON keys<br>passed individually.,Frontend
disable-access-log-for-endpoints,str,None,,"Comma-separated list of endpoint paths to exclude from<br>uvicorn access logs. This is useful to reduce log<br>noise from high-frequency endpoints like health<br>checks. Example: ""/health,/metrics,/ping"". When set,<br>access logs for requests to these paths will be<br>suppressed while keeping logs for other endpoints.",Frontend
disable-fastapi-docs,Boolean flag,False,,"Disable FastAPI's OpenAPI schema, Swagger UI, and<br>ReDoc endpoint.",Frontend
no-disable-fastapi-docs,Boolean flag,False,,"Disable FastAPI's OpenAPI schema, Swagger UI, and<br>ReDoc endpoint.",Frontend
disable-uvicorn-access-log,Boolean flag,False,,Disable uvicorn access log.,Frontend
no-disable-uvicorn-access-log,Boolean flag,False,,Disable uvicorn access log.,Frontend
dp-supervisor-probe-failure-threshold,int,3,,Number of consecutive connection-error retries before<br>a child health probe is declared failed in multi-port<br>external LB mode.,Frontend
dp-supervisor-probe-interval-s,float,5.0,,Seconds between aggregated health probes in multi-port<br>external LB mode.,Frontend
dp-supervisor-probe-timeout-s,float,5.0,,Seconds to wait between retries when a child health<br>probe fails with a connection error in multi-port<br>external LB mode.,Frontend
enable-auto-tool-choice,Boolean flag,None,,N/A,Frontend
no-enable-auto-tool-choice,Boolean flag,None,,N/A,Frontend
enable-flash-late-interaction,Boolean flag,True,,"If set, run pooling score MaxSim on GPU in the API<br>server process. Can significantly improve late-<br>interaction scoring performance.",Frontend
no-enable-flash-late-interaction,Boolean flag,True,,"If set, run pooling score MaxSim on GPU in the API<br>server process. Can significantly improve late-<br>interaction scoring performance.",Frontend
enable-force-include-usage,Boolean flag,None,,N/A,Frontend
no-enable-force-include-usage,Boolean flag,None,,N/A,Frontend
enable-log-deltas,Boolean flag,None,,N/A,Frontend
no-enable-log-deltas,Boolean flag,None,,N/A,Frontend
enable-log-outputs,Boolean flag,None,,N/A,Frontend
no-enable-log-outputs,Boolean flag,None,,N/A,Frontend
enable-offline-docs,Boolean flag,False,,Enable offline FastAPI documentation for air-gapped<br>environments. Uses vendored static assets bundled with<br>vLLM.,Frontend
no-enable-offline-docs,Boolean flag,False,,Enable offline FastAPI documentation for air-gapped<br>environments. Uses vendored static assets bundled with<br>vLLM.,Frontend
enable-prompt-tokens-details,Boolean flag,None,,N/A,Frontend
no-enable-prompt-tokens-details,Boolean flag,None,,N/A,Frontend
enable-request-id-headers,Boolean flag,False,,"If specified, API server will add X-Request-Id header<br>to responses.",Frontend
no-enable-request-id-headers,Boolean flag,False,,"If specified, API server will add X-Request-Id header<br>to responses.",Frontend
enable-server-load-tracking,Boolean flag,None,,N/A,Frontend
no-enable-server-load-tracking,Boolean flag,None,,N/A,Frontend
enable-ssl-refresh,Boolean flag,False,,Refresh SSL Context when SSL certificate files change,Frontend
no-enable-ssl-refresh,Boolean flag,False,,Refresh SSL Context when SSL certificate files change,Frontend
enable-tokenizer-info-endpoint,Boolean flag,None,,N/A,Frontend
no-enable-tokenizer-info-endpoint,Boolean flag,None,,N/A,Frontend
exclude-tools-when-tool-choice-none,Boolean flag,None,,N/A,Frontend
no-exclude-tools-when-tool-choice-none,Boolean flag,None,,N/A,Frontend
fingerprint-mode,Enum,None,"custom,full,hash,none",N/A,Frontend
fingerprint-value,str,None,,N/A,Frontend
h11-max-header-count,int,256,,Maximum number of HTTP headers allowed in a request<br>for h11 parser. Helps mitigate header abuse. Default:<br>256.,Frontend
h11-max-incomplete-event-size,int,4194304,,Maximum size (bytes) of an incomplete HTTP event<br>(header or body) for h11 parser. Helps mitigate header<br>abuse. Default: 4194304 (4 MB).,Frontend
host,str,None,,Host name.,Frontend
log-config-file,str (file path),None,,N/A,Frontend
log-error-stack,Boolean flag,None,,N/A,Frontend
no-log-error-stack,Boolean flag,None,,N/A,Frontend
lora-modules,List,None,,N/A,Frontend
max-log-len,int,None,,N/A,Frontend
middleware,str,[],,"Additional ASGI middleware to apply to the app. We<br>accept multiple<br>--middleware arguments. The value should be an import<br>path. If a function is provided, vLLM will add it to<br>the server using `@app.middleware('http')`. If a class<br>is provided, vLLM will add it to the server using<br>`app.add_middleware()`.",Frontend
port,int,8000,,Port number.,Frontend
response-role,str,None,,N/A,Frontend
return-tokens-as-token-ids,Boolean flag,None,,N/A,Frontend
no-return-tokens-as-token-ids,Boolean flag,None,,N/A,Frontend
root-path,str,None,,FastAPI root_path when app is behind a path based<br>routing proxy.,Frontend
ssl-ca-certs,str (file path),None,,The CA certificates file.,Frontend
ssl-cert-reqs,int,0,,Whether client certificate is required (see stdlib ssl<br>module's).,Frontend
ssl-certfile,str (file path),None,,The file path to the SSL cert file.,Frontend
ssl-ciphers,str,None,,SSL cipher suites for HTTPS (TLS 1.2 and below only).<br>Example: 'ECDHE-RSA-AES256-GCM-SHA384:ECDHE-RSA-<br>CHACHA20-POLY1305',Frontend
ssl-keyfile,str (file path),None,,The file path to the SSL key file.,Frontend
tokens-only,Boolean flag,None,,N/A,Frontend
no-tokens-only,Boolean flag,None,,N/A,Frontend
tool-call-parser or name registered in --tool-parser-plugin,Enum,None,"apertus,cohere_command3,cohere_command4,deepseek_v3,deepseek_v31,deepseek_v32,deepseek_v4,ernie45,functiongemma,gemma4,gigachat3,glm45,glm47,granite,granite-20b-fc,granite4,hermes,hunyuan_a13b,hy_v3,internlm,jamba,kimi_k2,lfm2,llama3_json,llama4_json,llama4_pythonic,longcat,mimo,minicpm5,minimax,minimax_m2,mistral,olmo3,openai,phi4_mini_json,poolside_v1,pythonic,qwen3_coder,qwen3_xml,seed_oss,step3,step3p5,xlam",N/A,Frontend
tool-parser-plugin,str,None,,N/A,Frontend
tool-server,str,None,,N/A,Frontend
trust-request-chat-template,Boolean flag,None,,N/A,Frontend
no-trust-request-chat-template,Boolean flag,None,,N/A,Frontend
uds,str (socket path),None,,"Unix domain socket path. If set, host and port<br>arguments are ignored.",Frontend
uvicorn-log-level,Enum,info,"critical,debug,error,info,trace,warning",Log level for uvicorn.,Frontend
allow-deprecated-quantization,Boolean flag,False,,Whether to allow deprecated quantization methods.,ModelConfig
no-allow-deprecated-quantization,Boolean flag,False,,Whether to allow deprecated quantization methods.,ModelConfig
allowed-local-media-path,str,(empty string),,Allowing API requests to read local images or videos<br>from directories specified by the server file system.<br>This is a security risk. Should only be enabled in<br>trusted environments.,ModelConfig
allowed-media-domains,List,None,,"If set, only media URLs that belong to this domain can<br>be used for multi-modal inputs.",ModelConfig
code-revision,str,None,,"The specific revision to use for the model code on the<br>Hugging Face Hub. It can be a branch name, a tag name,<br>or a commit id. If unspecified, will use the default<br>version.",ModelConfig
config-format,Enum,auto,"'auto', 'hf', 'mistral'","The format of the model config to load:<br>- ""auto"" will try to load the config in hf format if<br>available after trying to load in mistral format.<br>- ""hf"" will load the config in hf format.<br>- ""mistral"" will load the config in mistral format.",ModelConfig
convert,Enum,auto,"auto,classify,embed,none",Convert the model using adapters defined in<br>[vllm.model_executor.models.adapters][]. The most<br>common use case is to adapt a text generation model to<br>be used for pooling tasks.,ModelConfig
disable-cascade-attn,Boolean flag,True,,"Disable cascade attention for V1. While cascade<br>attention does not change the mathematical<br>correctness, disabling it could be useful for<br>preventing potential numerical issues. This defaults<br>to True, so users must opt in to cascade attention by<br>setting this to False. Even when this is set to False,<br>cascade attention will only be used when the heuristic<br>tells that it's beneficial.",ModelConfig
no-disable-cascade-attn,Boolean flag,True,,"Disable cascade attention for V1. While cascade<br>attention does not change the mathematical<br>correctness, disabling it could be useful for<br>preventing potential numerical issues. This defaults<br>to True, so users must opt in to cascade attention by<br>setting this to False. Even when this is set to False,<br>cascade attention will only be used when the heuristic<br>tells that it's beneficial.",ModelConfig
disable-sliding-window,Boolean flag,False,,"Whether to disable sliding window. If True, we will<br>disable the sliding window functionality of the model,<br>capping to sliding window size. If the model does not<br>support sliding window, this argument is ignored.",ModelConfig
no-disable-sliding-window,Boolean flag,False,,"Whether to disable sliding window. If True, we will<br>disable the sliding window functionality of the model,<br>capping to sliding window size. If the model does not<br>support sliding window, this argument is ignored.",ModelConfig
dtype,Enum,auto,"auto,bfloat16,float,float16,float32,half","Data type for model weights and activations:<br>- ""auto"" will use FP16 precision for FP32 and FP16<br>models, and BF16 precision for BF16 models.<br>- ""half"" for FP16. Recommended for AWQ quantization.<br>- ""float16"" is the same as ""half"".<br>- ""bfloat16"" for a balance between precision and<br>range.<br>- ""float"" is shorthand for FP32 precision.<br>- ""float32"" for FP32 precision.",ModelConfig
enable-cumem-allocator,Boolean flag,False,,Enable the custom cumem allocator to leverage advanced<br>GPU memory allocation features such as multi-node<br>NVLink support.<br>Sleep mode automatically enables this allocator. Only<br>cuda and hip platforms are supported.,ModelConfig
no-enable-cumem-allocator,Boolean flag,False,,Enable the custom cumem allocator to leverage advanced<br>GPU memory allocation features such as multi-node<br>NVLink support.<br>Sleep mode automatically enables this allocator. Only<br>cuda and hip platforms are supported.,ModelConfig
enable-prompt-embeds,Boolean flag,False,,"If `True`, enables passing text embeddings as inputs<br>via the `prompt_embeds` key.<br>WARNING: The vLLM engine may crash if incorrect shape<br>of embeddings is passed. Only enable this flag for<br>trusted users!",ModelConfig
no-enable-prompt-embeds,Boolean flag,False,,"If `True`, enables passing text embeddings as inputs<br>via the `prompt_embeds` key.<br>WARNING: The vLLM engine may crash if incorrect shape<br>of embeddings is passed. Only enable this flag for<br>trusted users!",ModelConfig
enable-return-routed-experts,Boolean flag,False,,Whether to return routed experts.,ModelConfig
no-enable-return-routed-experts,Boolean flag,False,,Whether to return routed experts.,ModelConfig
enable-sleep-mode,Boolean flag,False,,Enable sleep mode for the engine (only cuda and hip<br>platforms are supported).,ModelConfig
no-enable-sleep-mode,Boolean flag,False,,Enable sleep mode for the engine (only cuda and hip<br>platforms are supported).,ModelConfig
enforce-eager,Boolean flag,False,,"Whether to always use eager-mode PyTorch. If True, we<br>will disable CUDA graph and always execute the model<br>in eager mode. If False, we will use CUDA graph and<br>eager execution in hybrid for maximal performance and<br>flexibility.",ModelConfig
no-enforce-eager,Boolean flag,False,,"Whether to always use eager-mode PyTorch. If True, we<br>will disable CUDA graph and always execute the model<br>in eager mode. If False, we will use CUDA graph and<br>eager execution in hybrid for maximal performance and<br>flexibility.",ModelConfig
generation-config,str,auto,,"The folder path to the generation config. Defaults to<br>`""auto""`, the generation config will be loaded from<br>model path. If set to `""vllm""`, no generation config<br>is loaded, vLLM defaults will be used. If set to a<br>folder path, the generation config will be loaded from<br>the specified folder path. If `max_new_tokens` is<br>specified in generation config, then it sets a server-<br>wide limit on the number of output tokens for all<br>requests.",ModelConfig
hf-config-path,str,None,,"Name or path of the Hugging Face config to use. If<br>unspecified, model name or path will be used.",ModelConfig
hf-overrides,dict,{},,"If a dictionary, contains arguments to be forwarded to<br>the Hugging Face config. If a callable, it is called<br>to update the HuggingFace config.",ModelConfig
hf-token,str,None,,"The token to use as HTTP bearer authorization for<br>remote files . If `True`, will use the token generated<br>when running `hf auth login` (stored in<br>`~/.cache/huggingface/token`).",ModelConfig
io-processor-plugin,str,None,,IOProcessor plugin name to load at model startup,ModelConfig
logits-processors,List,None,,One or more logits processors' fully-qualified class<br>names or class definitions,ModelConfig
logprobs-mode,Enum,raw_logprobs,"processed_logits,processed_logprobs,raw_logits,raw_logprobs","Indicates the content returned in the logprobs and<br>prompt_logprobs. Supported mode: 1) raw_logprobs, 2)<br>processed_logprobs, 3) raw_logits, 4)<br>processed_logits. Raw means the values before applying<br>any logit processors, like bad words. Processed means<br>the values after applying all processors, including<br>temperature and top_k/top_p.",ModelConfig
max-logprobs,int,20,,"Maximum number of log probabilities to return when<br>`logprobs` is specified in `SamplingParams`. The<br>default value comes the default for the OpenAI Chat<br>Completions API. -1 means no cap, i.e. all<br>(output_length * vocab_size) logprobs are allowed to<br>be returned and it may cause OOM.",ModelConfig
max-model-len,int,None,,"Model context length (prompt and output). If<br>unspecified, will be automatically derived from the<br>model config.<br>When passing via `--max-model-len`, supports<br>k/m/g/K/M/G in human-readable format. Examples:<br>- 1k -> 1000<br>- 1K -> 1024<br>- 25.6k -> 25,600<br>- -1 or 'auto' -> Automatically choose the maximum<br>model length that fits in GPU memory. This will use<br>the model's maximum context length if it fits,<br>otherwise it will find the largest length that can be<br>accommodated.<br>Parse human-readable integers like '1k', '2M', etc.<br>Including decimal values with decimal multipliers.<br>Also accepts -1 or 'auto' as a special value for auto-<br>detection.<br>    Examples:<br>    - '1k' -> 1,000<br>    - '1K' -> 1,024<br>    - '25.6k' -> 25,600<br>    - '-1' or 'auto' -> -1 (special value for auto-<br>detection)",ModelConfig
model,str,Qwen/Qwen3-0.6B,,Name or path of the Hugging Face model to use. It is<br>also used as the content for `model_name` tag in<br>metrics output when `served_model_name` is not<br>specified.,ModelConfig
model-impl,Enum,auto,"'auto', 'terratorch', 'transformers', 'vllm'","Which implementation of the model to use:<br>- ""auto"" will try to use the vLLM implementation, if<br>it exists, and fall back to the Transformers<br>implementation if no vLLM implementation is available.<br>- ""vllm"" will use the vLLM model implementation.<br>- ""transformers"" will use the Transformers model<br>implementation.<br>- ""terratorch"" will use the TerraTorch model<br>implementation.",ModelConfig
override-attention-dtype,str,None,,Override dtype for attention,ModelConfig
override-generation-config,dict,{},,"Overrides or sets generation config. e.g.<br>`{""temperature"": 0.5}`. If used with `--generation-<br>config auto`, the override parameters will be merged<br>with the default config from the model. If used with<br>`--generation-config vllm`, only the override<br>parameters are used.<br>Should either be a valid JSON string or JSON keys<br>passed individually.",ModelConfig
pooler-config,dict (PoolerConfig),None,,Pooler config which controls the behaviour of output<br>pooling in pooling models.<br>API docs: https://docs.vllm.ai/en/latest/api/vllm/conf<br>ig/#vllm.config.PoolerConfig<br>Should either be a valid JSON string or JSON keys<br>passed individually.,ModelConfig
quantization,str,None,,"Method used to quantize the weights. If `None`, we<br>first check the `quantization_config` attribute in the<br>model config file. If that is `None`, we assume the<br>model weights are not quantized and use `dtype` to<br>determine the data type of the weights.",ModelConfig
quantization-config,dict (QuantizationConfigArgs),None,,"User-facing quantization configuration. Carries per-<br>layer-kind specs (linear, moe) and ignore patterns;<br>see :class:`QuantizationConfigArgs`. Auto-populated<br>from the matching online shorthand when `quantization`<br>is one of the values in<br>`ONLINE_QUANT_SHORTHAND_NAMES`.<br>API docs: https://docs.vllm.ai/en/latest/api/vllm/conf<br>ig/#vllm.config.QuantizationConfigArgs<br>Should either be a valid JSON string or JSON keys<br>passed individually.",ModelConfig
renderer-num-workers,int,1,,"Number of worker threads in the renderer thread pool.<br>The pool is consumed by the async renderer path (e.g.<br>the OpenAI-compatible API server started by `vllm<br>serve`) to parallelize tokenization, chat template<br>rendering, and multimodal preprocessing across<br>concurrent requests.<br>The offline `LLM` entrypoint uses the synchronous<br>renderer path and processes prompts (including<br>multimodal preprocessing) serially, so this setting<br>has no effect there.",ModelConfig
revision,str,None,,"The specific model version to use. It can be a branch<br>name, a tag name, or a commit id. If unspecified, will<br>use the default version.",ModelConfig
runner,Enum,auto,"auto,draft,generate,pooling","The type of model runner to use. Each vLLM instance<br>only supports one model runner, even if the same model<br>can be used for multiple types.",ModelConfig
seed,int,0,,"Random seed for reproducibility.<br>We must set the global seed because otherwise,<br>different tensor parallel workers would sample<br>different tokens, leading to inconsistent results.",ModelConfig
served-model-name,List,None,,"The model name(s) used in the API. If multiple names<br>are provided, the server will respond to any of the<br>provided names. The model name in the model field of a<br>response will be the first name in this list. If not<br>specified, the model name will be the same as the<br>`--model` argument. Noted that this name(s) will also<br>be used in `model_name` tag content of prometheus<br>metrics, if multiple names provided, metrics tag will<br>take the first one.",ModelConfig
skip-tokenizer-init,Boolean flag,False,,Skip initialization of tokenizer and detokenizer.<br>Expects valid `prompt_token_ids` and `None` for prompt<br>from the input. The generated output will contain<br>token ids.,ModelConfig
no-skip-tokenizer-init,Boolean flag,False,,Skip initialization of tokenizer and detokenizer.<br>Expects valid `prompt_token_ids` and `None` for prompt<br>from the input. The generated output will contain<br>token ids.,ModelConfig
tokenizer,str,None,,"Name or path of the Hugging Face tokenizer to use. If<br>unspecified, model name or path will be used.",ModelConfig
tokenizer-mode,Enum,auto,"'auto', 'deepseek_v32', 'deepseek_v4', 'hf', 'mistral', 'slow'","Tokenizer mode:<br>- ""auto"" will use the tokenizer from `mistral_common`<br>for Mistral models if available, otherwise it will use<br>the ""hf"" tokenizer.<br>- ""hf"" will use the fast tokenizer if available.<br>- ""slow"" will always use the slow tokenizer.<br>- ""mistral"" will always use the tokenizer from<br>`mistral_common`.<br>- ""deepseek_v32"" will always use the tokenizer from<br>`deepseek_v32`.<br>- ""deepseek_v4"" will always use the tokenizer from<br>`deepseek_v4`.<br>- ""qwen_vl"" will always use the tokenizer from<br>`qwen_vl`.<br>- Other custom values can be supported via plugins.<br>To swap the Rust BPE backend that powers HF fast<br>tokenizers for the<br>[fastokens](https://github.com/crusoecloud/fastokens)<br>implementation, set `VLLM_USE_FASTOKENS=1` instead —<br>that override applies to any mode that loads an HF<br>fast tokenizer (`hf`, `deepseek_v32`, `deepseek_v4`,<br>`qwen_vl`, …).",ModelConfig
tokenizer-revision,str,None,,"The specific revision to use for the tokenizer on the<br>Hugging Face Hub. It can be a branch name, a tag name,<br>or a commit id. If unspecified, will use the default<br>version.",ModelConfig
trust-remote-code,Boolean flag,False,,"Trust remote code (e.g., from HuggingFace) when<br>downloading the model and tokenizer.",ModelConfig
no-trust-remote-code,Boolean flag,False,,"Trust remote code (e.g., from HuggingFace) when<br>downloading the model and tokenizer.",ModelConfig
use-fp64-gumbel,Boolean flag,False,,Whether to use FP64 (instead of FP32) for the Gumbel<br>noise used by the sampler. FP64 reduces the chance of<br>ties in Gumbel-max sampling at the cost of<br>significantly lower kernel throughput on most GPUs.,ModelConfig
no-use-fp64-gumbel,Boolean flag,False,,Whether to use FP64 (instead of FP32) for the Gumbel<br>noise used by the sampler. FP64 reduces the chance of<br>ties in Gumbel-max sampling at the cost of<br>significantly lower kernel throughput on most GPUs.,ModelConfig
task,PoolingTask | None,None,,The task used for pooling.,PoolerConfig
pooling_type,SequencePoolingType | TokenPoolingType | None,None,,The pooling method used for pooling.,PoolerConfig
seq_pooling_type,SequencePoolingType | None,None,,The pooling method used for sequence pooling.,PoolerConfig
tok_pooling_type,TokenPoolingType | None,None,,The pooling method used for tokenwise pooling.,PoolerConfig
use_activation,bool | None,None,,Whether to apply activation function to the pooler outputs.,PoolerConfig
dimensions,int | None,None,,Reduce the dimensions of embeddings if model supports matryoshka representation.,PoolerConfig
enable_chunked_processing,bool,False,,Whether to enable chunked processing for long inputs.,PoolerConfig
max_embed_len,int | None,None,,Maximum input length allowed for embedding generation.,PoolerConfig
logit_mean,float | None,None,,"If provided, subtract this value from classification logits before activation.",PoolerConfig
logit_sigma,float | None,None,,"If provided, divide the classification logits by this value after mean subtraction.",PoolerConfig
step_tag_id,int | None,None,,"If set, only the score corresponding to the step_tag_id in the generated sentence should be returned.",PoolerConfig
returned_token_ids,list[int] | None,None,,A list of indices for the vocabulary dimensions to be extracted.,PoolerConfig
linear,QuantSpec | None,None,,Quantization spec applied to LinearBase layers.,QuantizationConfigArgs
moe,QuantSpec | None,None,,Quantization spec applied to FusedMoE layers.,QuantizationConfigArgs
ignore,list[str],[],,Layers to skip quantization for.,QuantizationConfigArgs
