Name,Type,Default,Choices,Description,Config
enable-chunked-prefill,Boolean flag,None,,"If True, prefill requests can be chunked based on the<br>remaining `max_num_batched_tokens`.<br>The default value here is mainly for convenience when<br>testing. In real usage, this should be set in<br>`EngineArgs.create_engine_config`.",SchedulerConfig
no-enable-chunked-prefill,Boolean flag,None,,"If True, prefill requests can be chunked based on the<br>remaining `max_num_batched_tokens`.<br>The default value here is mainly for convenience when<br>testing. In real usage, this should be set in<br>`EngineArgs.create_engine_config`.",SchedulerConfig
long-prefill-token-threshold,int,0,,"For chunked prefill, a request is considered long if<br>the prompt is longer than this number of tokens.",SchedulerConfig
max-long-partial-prefills,int,1,,"For chunked prefill, the maximum number of prompts<br>longer than long_prefill_token_threshold that will be<br>prefilled concurrently. Setting this less than<br>max_num_partial_prefills will allow shorter prompts to<br>jump the queue in front of longer prompts in some<br>cases, improving latency.",SchedulerConfig
max-num-batched-tokens,int,None,,"Maximum number of tokens that can be processed in a<br>single iteration.<br>The default value here is mainly for convenience when<br>testing. In real usage, this should be set in<br>`EngineArgs.create_engine_config`.<br>Parse human-readable integers like '1k', '2M', etc.<br>Including decimal values with decimal multipliers.<br>    Examples:<br>    - '1k' -> 1,000<br>    - '1K' -> 1,024<br>    - '25.6k' -> 25,600",SchedulerConfig
max-num-partial-prefills,int,1,,"For chunked prefill, the maximum number of sequences<br>that can be partially prefilled concurrently.",SchedulerConfig
max-num-seqs,int,None,,"Maximum number of sequences to be processed in a<br>single iteration.<br>The default value here is mainly for convenience when<br>testing. In real usage, this should be set in<br>`EngineArgs.create_engine_config`.",SchedulerConfig
scheduler-cls,str,None,,"The scheduler class to use.<br>""vllm.v1.core.sched.scheduler.Scheduler"" is the<br>default scheduler. Can be a class directly or the path<br>to a class of form ""mod.custom_class"".",SchedulerConfig
scheduler-reserve-full-isl,Boolean flag,True,,"If True, the scheduler checks whether the full input<br>sequence length fits in the KV cache before admitting<br>a new request, rather than only checking the first<br>chunk. Prevents over-admission and KV cache thrashing<br>with chunked prefill.",SchedulerConfig
no-scheduler-reserve-full-isl,Boolean flag,True,,"If True, the scheduler checks whether the full input<br>sequence length fits in the KV cache before admitting<br>a new request, rather than only checking the first<br>chunk. Prevents over-admission and KV cache thrashing<br>with chunked prefill.",SchedulerConfig
scheduling-policy,Enum,fcfs,"fcfs,priority","The scheduling policy to use:<br>- ""fcfs"" means first come first served, i.e. requests<br>are handled in order  of arrival.<br>- ""priority"" means requests are handled based on given<br>priority (lower value means earlier handling) and time<br>of arrival deciding any ties).",SchedulerConfig
stream-interval,int,1,,"The interval (or buffer size) for streaming in terms<br>of token length. A smaller value (1) makes streaming<br>smoother by sending each token immediately, while a<br>larger value (e.g., 10) reduces host overhead and may<br>increase throughput by batching multiple tokens before<br>sending.",SchedulerConfig
cudagraph-capture-sizes,List,None,,Sizes to capture cudagraph.<br>- None (default): capture sizes are inferred from vllm<br>config.<br>- list[int]: capture sizes are specified as given.,CompilationConfig
max-cudagraph-capture-size,int,None,,"The maximum cudagraph capture size.<br>If cudagraph_capture_sizes is specified, this will be<br>set to the largest size in that list (or checked for<br>consistency if specified). If cudagraph_capture_sizes<br>is not specified, the list of sizes is generated<br>automatically following the pattern:<br>    [1, 2, 4] + list(range(8, 256, 8)) + list(<br>range(256, max_cudagraph_capture_size + 1, 16))<br>If not specified, max_cudagraph_capture_size is set to<br>min(max_num_seqs*2, 512) by default. This voids OOM in<br>tight memory scenarios with small max_num_seqs, and<br>prevents capture of many large graphs (>512) that<br>would greatly increase startup time with limited<br>performance benefit.",CompilationConfig
mode,CompilationMode | None,None` (V1 defaults to 3),,"The compilation approach: None=0, STOCK_TORCH_COMPILE=1, DYNAMO_TRACE_ONCE=2, VLLM_COMPILE=3.",CompilationConfig
debug_dump_path,Path | None,None,,The path to dump debug information for compilation.,CompilationConfig
cache_dir,str,"""""",,The directory to store the compiled graph.,CompilationConfig
compile_cache_save_format,"""binary"" | ""unpacked""","""binary""",,Format for saving torch compile cache: 'binary' or 'unpacked'.,CompilationConfig
backend,str,"""""",,The backend to use for weight transfer during RL training.,CompilationConfig
custom_ops,list[str],[],,Fine-grained control over which custom ops to enable/disable.,CompilationConfig
ir_enable_torch_wrap,bool | None,None,,"If True, enable vllm_ir torch custom op wrapping during the forward pass.",CompilationConfig
splitting_ops,list[str] | None,None,,"A list of ops to exclude from CUDA graphs, used in piecewise compilation.",CompilationConfig
compile_mm_encoder,bool,False,,Whether or not to compile the multimodal encoder.,CompilationConfig
cudagraph_mm_encoder,bool,False,,Enable CUDA graph capture for multimodal encoder (ViT).,CompilationConfig
encoder_cudagraph_token_budgets,list[int],[],,Token budget levels for encoder CUDA graph capture.,CompilationConfig
encoder_cudagraph_max_vision_items_per_batch,int,0,,Maximum number of images/videos per batch for encoder CUDA graph capture.,CompilationConfig
encoder_cudagraph_max_frames_per_batch,int | None,None,,Maximum total video frames per batch for encoder CUDA graph capture.,CompilationConfig
compile_sizes,list[int | str] | None,None,,Sizes to compile for Inductor.,CompilationConfig
compile_ranges_endpoints,list[int] | None,None,,Endpoints for Inductor compile ranges.,CompilationConfig
inductor_compile_config,dict,{},,Additional configurations for Inductor.,CompilationConfig
inductor_passes,"dict[str, str]",{},,Additional custom passes for Inductor.,CompilationConfig
cudagraph_mode,CUDAGraphMode | None,None,,"The mode of the CUDA graph: NONE, PIECEWISE, FULL, FULL_DECODE_ONLY, FULL_AND_PIECEWISE.",CompilationConfig
cudagraph_num_of_warmups,int,0,,Number of warmup runs for CUDA graph capture.,CompilationConfig
cudagraph_capture_sizes,list[int] | None,None,,Sizes to capture CUDA graph. None means inferred from vllm config.,CompilationConfig
cudagraph_copy_inputs,bool,False,,Whether to copy input tensors for CUDA graph.,CompilationConfig
cudagraph_specialize_lora,bool,True,,Whether to create separate CUDA graphs for cases with and without active LoRA adapters.,CompilationConfig
use_inductor_graph_partition,bool | None,None,,Use Inductor graph partition to split the graph at cudagraph_unsafe ops.,CompilationConfig
pass_config,PassConfig,{},,Custom Inductor passes configuration.,CompilationConfig
max_cudagraph_capture_size,int | None,None,,The maximum CUDA graph capture size.,CompilationConfig
dynamic_shapes_config,DynamicShapesConfig,see below,,Configuration for dynamic shapes options.,CompilationConfig
local_cache_dir,str | None,None,,Local cache dir for each rank.,CompilationConfig
fast_moe_cold_start,bool | None,None,,Optimization for fast MoE cold start.,CompilationConfig
static_all_moe_layers,list,[],,The names of all the MoE layers in the model.,CompilationConfig
fuse_norm_quant,bool | None,None,,Fuse the custom RMSNorm + quantization ops.,PassConfig
fuse_act_quant,bool | None,None,,Fuse the custom SiluMul + quantization ops.,PassConfig
fuse_attn_quant,bool | None,None,,Fuse the custom Attention and MLAAttention + quantization ops.,PassConfig
eliminate_noops,bool,True,,Eliminate no-op ops during compilation.,PassConfig
enable_sp,bool | None,None,,Enable sequence parallelism. Requires TP > 1.,PassConfig
fuse_gemm_comms,bool | None,None,,Enable async tensor parallelism (TP) via GEMM+comm fusion.,PassConfig
fuse_allreduce_rms,bool | None,None,,Enable FlashInfer allreduce+RMSNorm fusion.,PassConfig
fuse_minimax_qk_norm,bool | None,"None` (deprecated, no effect)",,"Enable fused allreduce+RMSNorm for MiniMax QK norm (deprecated, no effect).",PassConfig
enable_qk_norm_rope_fusion,bool | None,None,,Enable fused Q/K RMSNorm + RoPE pass.,PassConfig
fuse_rope_kvcache_cat_mla,bool | None,None,,Enable fused MLA KV cache update with RoPE.,PassConfig
fuse_act_padding,bool | None,None` (ROCm only),,Fuse the custom RMSNorm + padding ops (ROCm only).,PassConfig
fuse_mla_dual_rms_norm,bool | None,None` (ROCm only),,Fuse paired q/kv RMS norms in MLA attention (ROCm only).,PassConfig
fuse_rope_kvcache,bool | None,None` (ROCm only),,Fuse the QK rope + KV cache ops (ROCm only).,PassConfig
rope_kvcache_fusion_max_token_num,int,256,,The threshold for ROCm AITER RoPE+KVCache fusion.,PassConfig
fi_allreduce_fusion_max_size_mb,float | None,None,,Threshold (MB) of tensor sizes under which FlashInfer fused allreduce is used.,PassConfig
sp_min_token_num,int | None,None,,Minimum number of tokens above which sequence parallelism is used.,PassConfig
type,"""backed"" | ""unbacked"" | ""backed_size_oblivious""","""backed""",,"Controls the type of dynamic shapes handling: backed, unbacked, or backed_size_oblivious.",DynamicShapesConfig
evaluate_guards,bool,False,,Debug mode to detect and fail if Dynamo specializes a dynamic shape.,DynamicShapesConfig
assume_32_bit_indexing,bool,False,,Whether all tensor sizes can use 32-bit indexing.,DynamicShapesConfig
enable-flashinfer-autotune,Boolean flag,None,,"If True, run FlashInfer autotuning during kernel<br>warmup.",KernelConfig
no-enable-flashinfer-autotune,Boolean flag,None,,"If True, run FlashInfer autotuning during kernel<br>warmup.",KernelConfig
ir-op-priority,dict (IrOpPriorityConfig),"IrOpPriorityConfig(rms_norm=[],<br>fused_add_rms_norm=[])",,vLLM IR op priority for dispatching/lowering during<br>the forward pass. Platform defaults appended<br>automatically during VllmConfig.__post_init__.<br>API docs: https://docs.vllm.ai/en/latest/api/vllm/conf<br>ig/#vllm.config.IrOpPriorityConfig<br>Should either be a valid JSON string or JSON keys<br>passed individually.,KernelConfig
linear-backend,Enum,auto,"aiter,auto,conch,cutlass,deep_gemm,emulation,exllama,fbgemm,flashinfer_cudnn,flashinfer_cutlass,flashinfer_trtllm,machete,marlin,torch,triton","Backend for quantized linear layer GEMM kernels.<br>Available options:<br>- ""auto"": Automatically select the best backend based<br>on model and hardware<br>- ""cutlass"": Use CUTLASS-based kernels<br>- ""flashinfer_cutlass"": Use FlashInfer with CUTLASS<br>kernels<br>- ""flashinfer_trtllm"": Use FlashInfer with TensorRT-<br>LLM kernels<br>- ""flashinfer_cudnn"": Use FlashInfer with cuDNN<br>kernels<br>- ""marlin"": Use Marlin kernels<br>- ""triton"": Use Triton-based kernels<br>- ""deep_gemm"": Use DeepGEMM kernels<br>- ""torch"": Use PyTorch native scaled_mm kernels<br>- ""aiter"": Use AMD AITer kernels (ROCm only)<br>- ""machete"": Use Machete kernels (mixed-precision)<br>- ""fbgemm"": Use FBGEMM kernels<br>- ""conch"": Use Conch mixed-precision kernels<br>- ""exllama"": Use Exllama mixed-precision kernels<br>- ""emulation"": Use slow dequant-to-BF16 emulation (for<br>testing only)",KernelConfig
moe-backend,Enum,auto,"aiter,auto,cutlass,deep_gemm,deep_gemm_mega_moe,emulation,flashinfer_b12x,flashinfer_cutedsl,flashinfer_cutlass,flashinfer_trtllm,humming,marlin,triton,triton_unfused","Backend for MoE expert computation kernels. Available<br>options:<br>- ""auto"": Automatically select the best backend based<br>on model and hardware<br>- ""triton"": Use Triton-based fused MoE kernels<br>- ""deep_gemm"": Use DeepGEMM kernels (FP8 block-<br>quantized only)<br>- ""deep_gemm_mega_moe"": Use DeepGEMM mega MoE kernels<br>- ""cutlass"": Use vLLM CUTLASS kernels<br>- ""flashinfer_trtllm"": Use FlashInfer with TRTLLM-GEN<br>kernels<br>- ""flashinfer_cutlass"": Use FlashInfer with CUTLASS<br>kernels<br>- ""flashinfer_cutedsl"": Use FlashInfer with CuteDSL<br>kernels (FP4 only)<br>- ""flashinfer_b12x"": Use FlashInfer CuteDSL fused MoE<br>for SM12x (RTX Pro 6000 / DGX Spark)<br>- ""marlin"": Use Marlin kernels (weight-only<br>quantization)<br>- ""humming"": Use Humming Mixed Precision kernels<br>- ""triton_unfused"": Use Triton unfused MoE kernels<br>- ""aiter"": Use AMD AITer kernels (ROCm only)<br>- ""emulation"": use BF16/FP16 GEMM, dequantizing<br>weights and running QDQ on activations.",KernelConfig
rms_norm,list[str],[],,Priority list for vllm.ir.ops.rms_norm dispatch.,IrOpPriorityConfig
fused_add_rms_norm,list[str],[],,Priority list for vllm.ir.ops.fused_add_rms_norm dispatch.,IrOpPriorityConfig
additional-config,dict,{},,Additional config for specified platform. Different<br>platforms may support different configs. Make sure the<br>configs are valid for the platform you are using.<br>Contents must be hashable.,VllmConfig
attention-config,dict (AttentionConfig),"AttentionConfig(backend=None, flash_attn_version=None,<br>use_prefill_decode_attention=False,<br>flash_attn_max_num_splits_for_cuda_graph=32,<br>tq_max_kv_splits_for_cuda_graph=32,<br>use_trtllm_attention=None,<br>disable_flashinfer_q_quantization=False,<br>mla_prefill_backend=None,<br>use_prefill_query_quantization=False,<br>use_fp4_indexer_cache=False, use_non_causal=False,<br>flex_attn_block_m=None, flex_attn_block_n=None,<br>flex_attn_q_block_size=None,<br>flex_attn_kv_block_size=None)",,Attention configuration.<br>API docs: https://docs.vllm.ai/en/latest/api/vllm/conf<br>ig/#vllm.config.AttentionConfig<br>Should either be a valid JSON string or JSON keys<br>passed individually.,VllmConfig
compilation-config,dict (CompilationConfig),"{'mode': None,<br>'debug_dump_path': None, 'cache_dir': '',<br>'compile_cache_save_format': 'binary', 'backend': 'vll<br>m_ascend.compilation.compiler_interface.AscendCompiler<br>', 'custom_ops': [], 'ir_enable_torch_wrap': None,<br>'splitting_ops': None, 'compile_mm_encoder': False,<br>'cudagraph_mm_encoder': False,<br>'encoder_cudagraph_token_budgets': [],<br>'encoder_cudagraph_max_vision_items_per_batch': 0,<br>'encoder_cudagraph_max_frames_per_batch': None,<br>'compile_sizes': None, 'compile_ranges_endpoints':<br>None, 'inductor_compile_config':<br>{'enable_auto_functionalized_v2': False,<br>'size_asserts': False, 'alignment_asserts': False,<br>'scalar_asserts': False, 'combo_kernels': True,<br>'benchmark_combo_kernel': True}, 'inductor_passes':<br>{}, 'cudagraph_mode': None,<br>'cudagraph_num_of_warmups': 0,<br>'cudagraph_capture_sizes': None,<br>'cudagraph_copy_inputs': False,<br>'cudagraph_specialize_lora': True,<br>'use_inductor_graph_partition': None, 'pass_config':<br>{}, 'max_cudagraph_capture_size': None,<br>'dynamic_shapes_config': {'type':<br><DynamicShapesType.BACKED: 'backed'>,<br>'evaluate_guards': False, 'assume_32_bit_indexing':<br>False}, 'local_cache_dir': None,<br>'fast_moe_cold_start': None, 'static_all_moe_layers':<br>[]}",,"torch.compile` and cudagraph capture configuration<br>for the model.<br>As a shorthand, one can append compilation arguments<br>via<br>-cc.parameter=argument such as `-cc.mode=3` (same as<br>`-cc='{""mode"":3}'`).<br>You can specify the full compilation config like so:<br>`{""mode"": 3, ""cudagraph_capture_sizes"": [1, 2, 4, 8]}`<br>API docs: https://docs.vllm.ai/en/latest/api/vllm/conf<br>ig/#vllm.config.CompilationConfig<br>Should either be a valid JSON string or JSON keys<br>passed individually.",VllmConfig
ec-transfer-config,dict (ECTransferConfig),None,,The configurations for distributed EC cache transfer.<br>API docs: https://docs.vllm.ai/en/latest/api/vllm/conf<br>ig/#vllm.config.ECTransferConfig<br>Should either be a valid JSON string or JSON keys<br>passed individually.,VllmConfig
kernel-config,dict (KernelConfig),"KernelConfig(ir_op_prio<br>rity=IrOpPriorityConfig(rms_norm=[],<br>fused_add_rms_norm=[]),<br>enable_flashinfer_autotune=None, moe_backend='auto',<br>linear_backend='auto')",,Kernel configuration.<br>API docs: https://docs.vllm.ai/en/latest/api/vllm/conf<br>ig/#vllm.config.KernelConfig<br>Should either be a valid JSON string or JSON keys<br>passed individually.,VllmConfig
kv-events-config,dict (KVEventsConfig),None,,The configurations for event publishing.<br>API docs: https://docs.vllm.ai/en/latest/api/vllm/conf<br>ig/#vllm.config.KVEventsConfig<br>Should either be a valid JSON string or JSON keys<br>passed individually.,VllmConfig
kv-transfer-config,dict (KVTransferConfig),None,,The configurations for distributed KV cache transfer.<br>API docs: https://docs.vllm.ai/en/latest/api/vllm/conf<br>ig/#vllm.config.KVTransferConfig<br>Should either be a valid JSON string or JSON keys<br>passed individually.,VllmConfig
optimization-level,int,2,,"The optimization level. These levels trade startup<br>time cost for performance, with -O0 having the best<br>startup time and -O3 having the best performance. -O2<br>is used by default. See OptimizationLevel for full<br>description.",VllmConfig
performance-mode,Enum,balanced,"balanced,interactivity,throughput","Performance mode for runtime behavior, 'balanced' is<br>the default. 'interactivity' favors low end-to-end<br>per-request latency at small batch sizes (fine-grained<br>CUDA graphs, latency-oriented kernels). 'throughput'<br>favors aggregate tokens/sec at high concurrency<br>(larger CUDA graphs, more aggressive batching,<br>throughput-oriented kernels).",VllmConfig
profiler-config,dict (ProfilerConfig),"ProfilerConfig(profiler=None, torch_profiler_dir='',<br>torch_profiler_with_stack=True,<br>torch_profiler_with_flops=False,<br>torch_profiler_use_gzip=True,<br>torch_profiler_dump_cuda_time_total=True,<br>torch_profiler_record_shapes=False,<br>torch_profiler_with_memory=False,<br>ignore_frontend=False, delay_iterations=0,<br>max_iterations=0, warmup_iterations=0,<br>active_iterations=5, wait_iterations=0)",,Profiling configuration.<br>API docs: https://docs.vllm.ai/en/latest/api/vllm/conf<br>ig/#vllm.config.ProfilerConfig<br>Should either be a valid JSON string or JSON keys<br>passed individually.,VllmConfig
reasoning-config,dict (ReasoningConfig),None,,The configurations for reasoning model.<br>API docs: https://docs.vllm.ai/en/latest/api/vllm/conf<br>ig/#vllm.config.ReasoningConfig<br>Should either be a valid JSON string or JSON keys<br>passed individually.,VllmConfig
spec-method,Enum,None,"custom_class,deepseek_mtp,dflash,draft_model,eagle,eagle3,ernie_mtp,exaone4_5_mtp,exaone_moe_mtp,extract_hidden_states,gemma4_mtp,glm4_moe_lite_mtp,glm4_moe_mtp,glm_ocr_mtp,hy_v3_mtp,longcat_flash_mtp,medusa,mimo_mtp,mimo_v2_mtp,mlp_speculator,mtp,nemotron_h_mtp,ngram,ngram_gpu,pangu_ultra_moe_mtp,qwen3_5_mtp,qwen3_next_mtp,step3p5_mtp,suffix,None","The name of the speculative method to use. If users<br>provide and set the `model` param, the speculative<br>method type will be detected automatically if<br>possible, if `model` param is not provided, the method<br>name must be provided.<br>If using `ngram` method, the related configuration<br>`prompt_lookup_max` and `prompt_lookup_min` should be<br>considered.",VllmConfig
spec-model,str,None,,"The name of the draft model, eagle head, or additional<br>weights, if provided.",VllmConfig
spec-tokens,int,None,,"The number of speculative tokens, if provided. It will<br>default to the number in the draft model config if<br>present, otherwise, it is required.",VllmConfig
speculative-config,dict (SpeculativeConfig),None,,Speculative decoding configuration.<br>API docs: https://docs.vllm.ai/en/latest/api/vllm/conf<br>ig/#vllm.config.SpeculativeConfig<br>Should either be a valid JSON string or JSON keys<br>passed individually.,VllmConfig
structured-outputs-config,dict (StructuredOutputsConfig),"StructuredOutputsConfig(backend='auto',<br>disable_any_whitespace=False,<br>disable_additional_properties=False,<br>reasoning_parser='', reasoning_parser_plugin='',<br>enable_in_reasoning=False)",,Structured outputs configuration.<br>API docs: https://docs.vllm.ai/en/latest/api/vllm/conf<br>ig/#vllm.config.StructuredOutputsConfig<br>Should either be a valid JSON string or JSON keys<br>passed individually.,VllmConfig
weight-transfer-config,dict (WeightTransferConfig),None,,The configurations for weight transfer during RL<br>training.<br>API docs: https://docs.vllm.ai/en/latest/api/vllm/conf<br>ig/#vllm.config.WeightTransferConfig<br>Should either be a valid JSON string or JSON keys<br>passed individually.,VllmConfig
ec_connector,str | None,None,,The EC connector for transmitting EC caches between vLLM instances.,ECTransferConfig
ec_buffer_device,str | None,"""cuda""",,The device used by EC connector to buffer the EC cache (currently only 'cuda').,ECTransferConfig
ec_buffer_size,float,1e9,,The buffer size for TorchDistributedConnector (~1GB recommended).,ECTransferConfig
ec_role,ECRole | None,None,,"Whether this vLLM instance produces, consumes EC cache, or both.",ECTransferConfig
ec_rank,int | None,None,,The rank of this vLLM instance in the EC cache transfer.,ECTransferConfig
ec_parallel_size,int,1,,The number of parallel instances for EC cache transfer.,ECTransferConfig
ec_ip,str,"""127.0.0.1""",,The EC connector IP address.,ECTransferConfig
ec_port,int,14579,,The EC connector port.,ECTransferConfig
ec_connector_extra_config,"dict[str, Any]",{},,Any extra config that the EC connector may need.,ECTransferConfig
ec_connector_module_path,str | None,None,,The Python module path to dynamically load the EC connector from.,ECTransferConfig
enable_kv_cache_events,bool,False,,"If True, enable KV cache events for tracking block storage and removal.",KVEventsConfig
publisher,"""null"" | ""zmq""","None` (post_init: `""zmq""` if events enabled, else `""null""`)",,The publisher to use for publishing KV events: 'null' or 'zmq'.,KVEventsConfig
endpoint,str,"""tcp://*:5557""",,The ZMQ endpoint to use for publishing KV events.,KVEventsConfig
replay_endpoint,str | None,None,,The ZMQ endpoint to use for replaying KV events.,KVEventsConfig
buffer_steps,int,10000,,The number of steps to cache for the replay endpoint.,KVEventsConfig
hwm,int,100000,,The ZMQ high water mark for the event publisher.,KVEventsConfig
max_queue_size,int,100000,,The maximum number of events to queue while waiting for publishing.,KVEventsConfig
topic,str,"""""",,The topic to use for the event publisher.,KVEventsConfig
kv_connector,str | None,None,,The KV connector for transmitting KV caches between vLLM instances.,KVTransferConfig
kv_buffer_device,str,platform device type,,"The device used by KV connector to buffer the KV cache: 'cuda', 'cpu', or 'xpu'.",KVTransferConfig
kv_buffer_size,float,1e9,,The buffer size for TorchDistributedConnector (~1GB recommended).,KVTransferConfig
kv_role,KVRole | None,None,,"Whether this vLLM instance produces, consumes KV cache, or both.",KVTransferConfig
kv_rank,int | None,None,,The rank of this vLLM instance in the KV cache transfer.,KVTransferConfig
kv_parallel_size,int,1,,The number of parallel instances for KV cache transfer.,KVTransferConfig
kv_ip,str,"""127.0.0.1""",,The KV connector IP address.,KVTransferConfig
kv_port,int,14579,,The KV connector port.,KVTransferConfig
kv_connector_extra_config,"dict[str, Any]",{},,Any extra config that the KV connector may need.,KVTransferConfig
kv_connector_module_path,str | None,None,,The Python module path to dynamically load the KV connector from.,KVTransferConfig
enable_permute_local_kv,bool,False,,Experimental flag to enable HND to NHD KV transfer.,KVTransferConfig
kv_load_failure_policy,"""recompute"" | ""fail""","""fail""",,Policy for handling KV cache load failures: 'recompute' or 'fail'.,KVTransferConfig
profiler,ProfilerKind | None,None,,Which profiler to use: 'torch' or 'cuda'.,ProfilerConfig
torch_profiler_dir,str,"""""",,Directory to save torch profiler traces.,ProfilerConfig
torch_profiler_with_stack,bool,True,,"If True, enables stack tracing in the torch profiler.",ProfilerConfig
torch_profiler_with_flops,bool,False,,"If True, enables FLOPS counting in the torch profiler.",ProfilerConfig
torch_profiler_use_gzip,bool,True,,"If True, saves torch profiler traces in gzip format.",ProfilerConfig
torch_profiler_dump_cuda_time_total,bool,True,,"If True, dumps total CUDA time in torch profiler traces.",ProfilerConfig
torch_profiler_record_shapes,bool,False,,"If True, records tensor shapes in the torch profiler.",ProfilerConfig
torch_profiler_with_memory,bool,False,,"If True, enables memory profiling in the torch profiler.",ProfilerConfig
ignore_frontend,bool,False,,"If True, disables front-end profiling of AsyncLLM when using the 'torch' profiler.",ProfilerConfig
delay_iterations,int,0,,Number of engine iterations to skip before starting profiling.,ProfilerConfig
max_iterations,int,0,,Maximum number of engine iterations to profile after starting.,ProfilerConfig
warmup_iterations,int,0,,Number of warmup iterations for PyTorch profiler schedule.,ProfilerConfig
active_iterations,int,5,,Number of active iterations for PyTorch profiler schedule.,ProfilerConfig
wait_iterations,int,0,,Number of wait iterations for PyTorch profiler schedule.,ProfilerConfig
reasoning_parser,str,"""""",,The name of the ReasoningParser to use for this model.,ReasoningConfig
reasoning_start_str,str,"""""",,String that indicates the start of reasoning content.,ReasoningConfig
reasoning_end_str,str,"""""",,String that indicates the end of reasoning content.,ReasoningConfig
